,title,score,id,url,comms_num,created,body,subreddit,query
40,"California public schools lost COVID-19 vaccine mandate lawsuit this week in court. With all the state, federal, BlackRock banking & big pharma support, they could not prove children needed these experiments. They also agreed in settlement to never mandate them again. No MSM coverage?",1958.0,v0afhl,https://www.eastbaytimes.com/2022/05/24/suit-settled-over-piedmont-schools-covid-19-vaccine-mandate/,228.0,1653828282.0,,conspiracy,big pharma
41,Government Says Big Pharma Kills More People Than All Illegal Drugs Combined,1943.0,3enjkc,http://collectivelyconscious.net/articles/government-says-big-pharma-kills-more-people-than-all-illegal-drugs-combined/,86.0,1437913162.0,,conspiracy,big pharma
42,"Joe Rogan blasts Big Pharma for exploiting the coronavirus pandemic for $: ""The amount of profit that's been generated by these pharmaceutical drug companies during this crisis from selling vaccines is fucking crazy, which is why it's terrifying that they're now trying to give it to children.""",1844.0,r4fb6o,https://twitter.com/VigilantFox/status/1465029211262005260?t=5i-QQ8lrNIJfLaJfMNkPSA&s=19,198.0,1638136072.0,,conspiracy,big pharma
43,"In an episode of ""Parts Unknown"" based in Massachusetts, Anthony Bourdain brought attention to how big pharma and their pharmaceutical opiates are the precursor to heroin addiction.",1814.0,8u6zpz,https://m.youtube.com/watch?v=ifbWtwlQkdE,154.0,1530076993.0,,conspiracy,big pharma
44,See how Big Pharma works?,1812.0,ovux56,https://i.redd.it/3kccux2dtre71.jpg,159.0,1627834226.0,,conspiracy,big pharma
45,"Citizen contacts Maryland Department of Health to find out why they are so keen to push the HPV jab on 11yo children, they cannot provide evidence, so he files a freedom of information request and discovers they've been bribed/lobbied by $91.6 million of washed Big Pharma money to market the vaccine",1805.0,pe3qbi,/r/conspiracy/comments/97i2d2/citizen_contacts_maryland_department_of_health_to/,153.0,1630271080.0,,conspiracy,big pharma
46,Big pharma shills can't give you one good reason to inject hot garbage made by criminals.,1795.0,nm6mts,https://i.redd.it/20xxrfygsn171.png,524.0,1622119548.0,,conspiracy,big pharma
47,All the Travis Scott posts are from bots flooding the page to dilute all the 'FBI raided journalists homes to hide that Biden molested his daughter',1772.0,qpshxb,https://www.reddit.com/r/conspiracy/comments/qpshxb/all_the_travis_scott_posts_are_from_bots_flooding/,443.0,1636421202.0,"I don't really believe like there's as much interest in this Travis Scott conspiracy as people are conveying here.  I think that bots on reddit are posting these to hide the posts from a few days ago about how the FBI raided project Veritas homes to prtotect Biden from having his daughters diary confessions leaked to the public.

Edit: and again the diary is STILL not the real reason for the raids, the real reason is to find the identities of the whistleblowers still working in big pharmas covid vax squad (pfizer, j&j, etc)",conspiracy,big pharma
48,Predictions for Biden's speech tomorrow,1757.0,rl1x5b,https://www.reddit.com/r/conspiracy/comments/rl1x5b/predictions_for_bidens_speech_tomorrow/,545.0,1640047892.0,"Will use the phrase Safe & Effective^TM at least 3 times

Will lean toward the camera and whisper ""get vaccinated"".

More demonizing the ""unvaccinated""

New restrictions and loss of freedoms for the unvaccinated.

*This administration is the best thing that ever happened to Big Pharma*",conspiracy,big pharma
49,This sub is fucking ruined.,1745.0,phlmzm,https://www.reddit.com/r/conspiracy/comments/phlmzm/this_sub_is_fucking_ruined/,1345.0,1630733341.0,"Edit: Look at all the comments directly proving my point. ""Conservative!""...""Right-wing!!!"" as I clearly said I'm not lol... Half the comments don't even have anything to do with my OP! Like you CAN'T make this shit up. Up until 300 comments last night things were mostly civil, now? Lol, shill and bot on!!!

----

It's so goddamn overrun by brainless mindless Liberals that it isn't even fun anymore. I can't even criticize the MSM or Big Pharma without being downvoted to Hell. First r/nonewnormal and now this sub. 

Just complete censorship, complete lack of information, this sub and now this whole site have just become a big echo chamber.

And before you hit me with that ""Oh it's just not your Conservative echo chamber you want""...first you bitches I'm an atheist, pro-choice, pro-universal health care, pre-police and military reform, etc. It's not about being a ""Right-wing nutjob"" it's about being able to OPENLY discuss things without it turning into a competition of who can be the biggest smart ass while saying nothing of actual substance. 

It's been getting worse month by month for the past year or so but it's at the point now where ANY thread I open at LEAST half the comments, if not more, are a bunch of naysayers that REAK of r/politics (you know the smell). Fuck you, fuck what you say, fuck what you link, fuck who you quote...YOU'RE WRONG. That's the only mindset they seem to have and it's...CONGRATULATIONS...ruined this sub.

How long until everyone goes private until this sub is banned? I mean, if you aren't pro-censorship on this site then what are you DOING HERE?!?!

Seriously, of all places on the internet my [comment](https://old.reddit.com/r/conspiracy/comments/phj41o/checkmatevaxbros_btfoagain/hbj8174/) here has been downvoted a dozen times in less than an hour...can someone tell me what I said WRONG, please? 

No one else wants to, surprise surprise.

This sub is being attacked. Think like them or you're one of ""*us*"".

Edit: Before the shills spout ""buts what's the conspiracy?!"" (as if they care) the conspiracy is that YOU people are conspiring to destroy and discredit this sub like you have dozens before because they don't cater to YOUR wrong-think.",conspiracy,big pharma
50,"The ""pandemic"" is a scam to make big pharma clients for life. Follow the money™",1731.0,q0tys5,https://i.redd.it/g6e2hk4cqbr71.jpg,96.0,1633305609.0,,conspiracy,big pharma
51,"If You Want to Kill Drug Dealers, Start with Big Pharma - Big Corporations, Not Street Dealers, Are the True Authors and Profiteers of the Opioid Crisis",1714.0,8ayxr0,https://www.commondreams.org/views/2018/04/05/if-you-want-kill-drug-dealers-start-big-pharma?utm_term=If%20You%20Want%20to%20Kill%20Drug%20Dealers%2C%20Start%20with%20Big%20Pharma&utm_campaign=News%20%2526%20Views%20%7C%20Shell%20Knew%2C%20Too&utm_content=email&utm_source=Daily%20Newsletter&utm_medium=email&cm_mmc=Act-On%20Software-_-email-_-News%20%2526%20Views%20%7C%20Shell%20Knew%2C%20Too-_-If%20You%20Want%20to%20Kill%20Drug%20Dealers%2C%20Start%20with%20Big%20Pharma,104.0,1523285040.0,,conspiracy,big pharma
52,"46,000 Americans killed each year by drug overdoses... most of them FDA-approved Big Pharma opioids... while medical system suppresses HEMP cures that render many painkillers obsolete",1699.0,48wsy3,http://www.naturalnews.com/053168_drug_overdose_deaths_opioids_Big_Pharma_painkillers.html#,128.0,1457087185.0,,conspiracy,big pharma
53,"Italy will require all workers to have a covid passport to be allowed to work. No jab = no work = out of the society. This is the start of the great reset, this is the start of war. NAZISM is back.",1688.0,ppq8aw,https://www.reddit.com/r/conspiracy/comments/ppq8aw/italy_will_require_all_workers_to_have_a_covid/,638.0,1631840966.0,"Italy will require all workers to have a covid passport to be allowed to work. No jab = no work = out of the society. Nazism is back.  


Clearly soon will be the same for others states, like France (another freemasons like Draghi, Macron) and USA....

&#x200B;

If you don't play at the Big Pharma russian roulette you will are out of this world.  
Thanks uncle Bill.",conspiracy,big pharma
54,GOP is Big Pharma owned shills,1617.0,wjgv8x,https://i.redd.it/lrzfpyegdjg91.jpg,793.0,1659984767.0,,conspiracy,big pharma
55,The best thing about the Freedom Convoy is that it forced the monster to come out into plain sight.,1553.0,sy1ofw,https://www.reddit.com/r/conspiracy/comments/sy1ofw/the_best_thing_about_the_freedom_convoy_is_that/,117.0,1645470757.0,"The agenda was strategic (give credit where credit is due). In fact, it was so well implanted, that most people were literally willing to give up all their freedoms as they desperately wanted to appear virtuous by ""following orders and saving lives"". 

With protesters refusing to let go, their strategy only allowed for them to double down. This in turn, forced the monster to come out much earlier than they planned. The monster was not ready and did not have the necessary time to hide its true nature. 

The emergency act, the presence of the UN on Canadian soil, the freezing of funds, the violence directed towards those calling for freedom; all of these things loudly roar out to the world that Canada is not a democracy. It is a communist country run by a foreign dictator.

Anyone who has been paying attention over the last few years clearly already understood this. 

Now its time for the majority (those who watch the msm and actually thought they were being good people by staying in their homes and injecting themselves with big pharma's experimental syringes) to see the truth. 

Fuck the whole ""saving lives"". The monster is in plain sight. Only ego and pride can blind one from seeing it now.",conspiracy,big pharma
56,We tried alternative treatment for covid and...,1551.0,s5tgd4,https://www.reddit.com/r/conspiracy/comments/s5tgd4/we_tried_alternative_treatment_for_covid_and/,623.0,1642389248.0,"The government is absolutely lying to us. We took Ivermectin and 3 hours later my fever broke and my husbands body aches were totally gone. I felt 50-60% better within 4 hours.  They're lying to us and it makes me sick thinking about all the people who have died so that big pharma can make money.

Update: man there are some mean people out there! Look, all I can tell you is my experience trying it. I took it and my fever broke. Coincidence? Could be. But my husband had the same experience. And, it sounds like everyone that has used it has had the same.",conspiracy,big pharma
57,"From day one, we were told to ""trust the science"" while scientists who didn't repeat Big Pharma/establishment talking points were silenced. If you're upset over polarization & misinformation about the pandemic, you have only the gatekeepers of information to blame.",1512.0,q3lyg9,https://i.redd.it/j62l4y4ga4s71.png,206.0,1633651273.0,,conspiracy,big pharma
58,"The swine flu vaccine was pulled after 25 deaths. It's now proven Pfizer surpassed H1N1 records in a matter of days. Recently released court-ordered documents reveal 1,223 vaccinated patients died within a 90 day period. No wonder why Big Pharma wanted to conceal all data from the public until 2076.",1505.0,t9wl6x,https://downthechupacabrahole.com/2022/03/08/sudden-adult-death-syndrome-predictive-programming-the-population/,226.0,1646790326.0,,conspiracy,big pharma
59,"Vimeo Bans Documentary Exposing Big Pharma’s Influence Within the WHO: There is a powerful presence of a digital Orwellian “fact checker” that’s going around the internet and social media deleting any evidence that threatens corporate, political, financial or elitist interests.",1478.0,g6pgfx,https://www.collective-evolution.com/2020/04/20/vimeo-bans-documentary-exposing-big-pharmas-influence-within-the-world-health-organization/,73.0,1587658225.0,,conspiracy,big pharma
60,"Big Pharma (Sickness Profiteers) help us, is the only Conspiracy we cannot document...",1461.0,rrgklb,https://i.redd.it/31q4kjooaj881.jpg,72.0,1640806563.0,,conspiracy,big pharma
61,The propaganda to allow corrupt multi billion dollar big pharma companies to experiment on children is here in full force,1451.0,p36lmi,https://i.redd.it/x4younij7zg71.jpg,474.0,1628795429.0,,conspiracy,big pharma
62,Instead of debating about Vaccines and masks. Who's better Trump or Biden. People should focus on the real problem. The Federal Reserve and the banking system.,1446.0,pf73sa,https://www.reddit.com/r/conspiracy/comments/pf73sa/instead_of_debating_about_vaccines_and_masks_whos/,251.0,1630420524.0,"The system that enslaves every America through inflationary debt. These wars and this fraudulent pandemic could never have endless funding without the ruling banking cartel printing endless dollars. The system is a failure and only benefits the extreme wealthy. Income tax is not constitutional. Bailouts to wealthiest corporations while smalls businesses go under are the repercussions of a failed system of oppressive debt put forth by the banking cartel to make every person in the world a slave to the dollar. It promotes inequality amongst our citizens and drives a wedge between all classes. The problem is not your white, black or your Asian counterparts. The very problem lies within the ruling class itself. The government imports drugs and sells them to our own people. They allow big pharma to sell us poison disguised as cures. The laws of the land are for the plebs to follow. People thrown in prison and jails for medial crimes while the super wealthy abide by no laws. Our tax dollars are being sent overseas to fund wars none of us support with the loss of countless American lives. The biggest problem is, they have everyone hooked on this system that everyone would lose everything if it were to collapse. Printing money is just economic heroin. I don't think our generation will fair well but unless something is done, we are setting up an even worse enslavement for future generations if something is not done. People need to open their eyes and wake up. If not for us, but for all future generations.


https://streamable.com/4ncem9",conspiracy,big pharma
63,The Vaccine is Killing people. This is undeniable at this point. Government officials want you hooked on big pharma for life. Meanwhile we still haven’t proven a single virus to cause disease.,1415.0,1041vm0,https://i.redd.it/r8l76l6ecaaa1.jpg,971.0,1672932889.0,,conspiracy,big pharma
64,Big pharma is the biggest cancer known to man,1418.0,hgh0tz,https://i.redd.it/9g5m6jcwtb751.jpg,240.0,1593208690.0,,conspiracy,big pharma
65,The biggest conspiracy of all is the mushroom conspiracy,1399.0,obmm51,https://www.reddit.com/r/conspiracy/comments/obmm51/the_biggest_conspiracy_of_all_is_the_mushroom/,547.0,1625148558.0,"Here’s why:
1. Stoned ape theory. Why is this not more popular? I think it makes a lot of sense actually.

2. You can only buy one type of mushroom (at most stores) and they even call it different names (portobello, button, baby bella, crimini) these are all the same mushroom. To me it looks like they are trying to deceive us by making it look like we have variety when we don’t.

3. Mushrooms really are medicine. They are full of nutrients and everyone is scared of them.

4. The best medicine we have is antibiotics and it comes from fungus. Why wouldn’t other fungus fight other bacteria’s and viruses? Well they do. People aren’t educated about them and fear them.

5. Mycologists believe the entire earths crust is covered in mycelium. Sometimes I wonder if they are responsible for the evolution of all things; if they make planets living if you will. We should send them to Mars and Venus and the moon. 

6. Even the rain needs mushrooms. The clouds can’t hold water without enough debris and the majority of that debris is spores.

7. Every breath you take has spores. These things are very significant…

8. In ancient China and ancient Egypt mushrooms were only for royalty commoners were punished for having them.

9. On the Joe Rogan show with Paul stamets, Paul had to stop the conversation when joe was prying for info on portobello mushrooms, and he said, “I can’t talk about this because I could get killed” 

10. The oldest mushroom fossil dates back 800 million to a billion years old….these things are incredibly evolved and don’t even need to have sex. You can break them apart and more will grow and faster. This is even a cultivation method. To put you in perspective, we only date back around 300,000 years.

11. I have been making my own extracts for a while now and I have been blowing my own mind with how much better my life has gotten since I started eating these and foraging and using them on my face and everything. Chanterelles, puffballs, boletes, honey mushrooms, 

12. A lot of people believe you can travel to different planets and areas in space when you eat psychedelic mushrooms. 

13. There are fungi in the rainforest that target specific animals when they get too overpopulated and balance out the nature so to say

14. Maria Sabina is a Mexican shaman who gave mushrooms to celebrities and royalty once westerners discovered them for enlightenment. The Beatles and Rockefeller even got mushrooms from her.

15. I fasted on foraged mushrooms for 2 months and pooped out dead pin worms. This happened 4 years ago. This makes me think about the scene in the matrix where Neo gets bugged. Metaphorically the red pill work well synonymously.

16. There are mushroom cave paintings around the world depicting bulls and mushrooms on the ground. Could this imply that they ate mushrooms and became artistic and were explaining that?

17. There are pictures of Jesus with mushrooms in stained glass windows at very popular historic churches around the world.

18. lion's mane mushroom and reishi mushroom are sold as nootropic supplements. the 5000 year old mummified corpse Ötzi was found in the alps in the 90s with Piptoporus betulinus attached to his belt. it may have been used as medicine.

19.LSD is also a fungus-derived drug made with ergotamine. ergotamine comes from Claviceps fungus.

20. ergotamine is also used in a migraine medicine called cafergot. it was obsoleted in the 90s with the introduction of sumatriptan but it still works for many people.

21. If you look up why psilocybin exists, the popular consensus is that it’s a poison to keep bugs and animals away. What I’ve seen is that they love that shit.I have seen families of centipedes come out from inside them. I have seen plenty of fire ant colony’s build their ant hill over a turd a day after I picked giant mushrooms out of it. Squirrels eat them. Snails love them. Everyone knows the nat flys love them.

22. The fact that they call the brain the “default mode network” when you become an adult and so little of your brain is lit up under an mri. But if you look at an adult on mushrooms or a child under an mri the whole brain is lit up. The creepy part is how they try to normalize it with the wording “default mode network”

23. Cordycept mushrooms take over the minds of insects and are parasitic to the insect. Paul stamets developed a way to rid termites forever and it is not used because it solves the problem completely. 
I sometimes wonder if psychedelic mushrooms are a symbiotic relationship when we eat them 🤷‍♂️ 

24. It is illegal to possess psychedelic mushrooms but not deathcaps or destroying angels. What is the real agenda here is it really safety?

25. Im saying that big pharma is part of the mushroom conspiracy because they are the answer to big pharma. One time I asked my doctor about mushrooms as medicine and he said, “have I heard of it? Im a victim of it!” I thought that was very strange I still have no explanation.

If life is a test I don’t think it’s a test how well we can listen to people. Maybe there is something special with them. Maybe we can listen and learn from them.


Does anyone agree with this? Let me know your thoughts. Please help share this post. (Govern-ment - to cntrl the min*] (conspire-I-c)",conspiracy,big pharma
66,"In the last 12-15 years, the left went from science oriented, anti-big pharma, anti-war, pro bodily autonomy, anti-racism, free speech and looking out for each other, to faith in big drug corporations, warmongering, forced med procedures, racism, censorship and cancel culture.",1381.0,t3z3ci,https://www.reddit.com/r/conspiracy/comments/t3z3ci/in_the_last_1215_years_the_left_went_from_science/,406.0,1646108296.0,,conspiracy,big pharma
67,Sheeple in r/coronavirus are starting to squirm due to changing definition of “fully vaccinated.”,1332.0,qw57ew,https://www.reddit.com/r/conspiracy/comments/qw57ew/sheeple_in_rcoronavirus_are_starting_to_squirm/,354.0,1637172533.0,"[You are no longer fully vaccinated after two shots. The definition has been changed to 3, and I noticed a lot of dissent and concern from people in the comments.](https://np.reddit.com/r/Coronavirus/comments/qw0f3o/the_definition_of_fully_vaccinated_is_changing_to/?utm_source=share&amp;amp;amp;utm_medium=ios_app&amp;amp;amp;utm_name=iossmf)

This is a stray from the norm in that sub. Seems like people over there have always been first in line for the shot. Reading the comments made me hopeful the vaccine/booster trend declines, rendering mandates useless and irrelevant.

Anecdote: My mom received a booster a few weeks ago, and declared it her last because she had weird side effects for a couple of days.

Does the government/big pharma honestly think the majority of people are going to voluntarily inject themselves over and over and over?? With a vaccine that doesn’t even fucking work??",conspiracy,big pharma
68,The world is obsessed with a cure or vaccine. No one is focusing on prevention. Immune health. Cardiovascular health. The poison we eat. Big pharma and bill gates is about to have a big pay day after all this.,1321.0,ftebiv,https://www.reddit.com/r/conspiracy/comments/ftebiv/the_world_is_obsessed_with_a_cure_or_vaccine_no/,252.0,1585795161.0,"Poison: our food..

If saving lives was truly the #1 focus for the CDC.. surely they’d be focusing on prevention (beyond stay at home).. addressing how a staggering and growing population of ppl have autoimmune issues.. the obesity problem.. the crap we eat.. how our healthcare systems need to change.. educating*** about the role of inflammation.. getting necessary vitamins from non processed fruits, veggies, and protein.. mental health! How many people die each year from heart disease?!? ..the yearly flu.. or even mental health related issues like suicide. We don’t blink an eye at these things. For hours everyday on Reddit I read how ppl are stress eating, getting high more, drinking more, gaining weight, not getting off the couch and going outside. People are scared and STRESSED. There is a lack of education! 

This has become fearmongering media warfare. Fear sells. Fear is clickbait.

Not claiming to know everything. There is a lot of information and misinformation out there. But this has become scifi. During this lock down we are powerless and at the governments mercy for our livelyhood.. I am waiting at my mailbox for my stimulus check to feed myself. This is a SLIPPERY slope into full on surveillance and control. I’m not a gun person but in Fresno and San Jose they have officially halted on firearm and ammo sales, alcohol, fuel, and there’s a curfew.. In this state of fear and paranoia the government is creeping in and gaining full control. Are we giving up our freedoms for a false sense of protection? Snowdon warned us about this. Are health and social point systems next? We all need to realize it’s not about teams or sides. Neither parties care about the people. They’re there for their own agendas. 

*No need to name call. This is a place for discussion and exchange of view points. I am allowed to question the motivations and intentions of world powers AND ALSO believe vaccines, science, and modern medicine. 🙄",conspiracy,big pharma
