,title,score,id,url,comms_num,created,body,subreddit,query
0,This is all on top of the fact that big pharma has avoided paying a combined $2.3 billion in taxes in the US,8959.0,hidysk,https://i.redd.it/xpp7skapfy751.jpg,490.0,1593482375.0,,conspiracy,big pharma
1,"The Mormon Church came out HARD against Utah's medical marijuana initiative. Last week, MormonLeaks leaked a doc proving the church owns nearly a billion in big pharma stocks. That's right, it likely had nothing to do with religion & everything to do with $$$.",8848.0,8o99tx,https://www.reddit.com/r/conspiracy/comments/8o99tx/the_mormon_church_came_out_hard_against_utahs/,350.0,1528040152.0,"Here is the  [LEAK](https://www.scribd.com/document/380562519/2017-12-31-Thirteen-LLC-Investment-Summary) that I based this reporting off of. Also,  [here](http://kutv.com/news/local/mormonleaks-says-new-documents-link-lds-church-to-companies-worth-over-32-billion) is an article about the leak.

[CELG](https://en.wikipedia.org/wiki/Celgene)  - 347 million in shares, 

[JNJ](https://en.wikipedia.org/wiki/Johnson_%26_Johnson) - 490 million in shares.

[ABT](https://en.wikipedia.org/wiki/Abbott_Laboratories) - 242 million in shares 

[GILD](https://en.wikipedia.org/wiki/Gilead_Sciences) - 101 million in shares 

[PFE](https://en.wikipedia.org/wiki/Pfizer) - 73 million in shares 

[ABBV](https://en.wikipedia.org/wiki/AbbVie_Inc.) - 39 million in shares 

[MRK](https://en.wikipedia.org/wiki/Merck_%26_Co.) - 19 million in shares


The church owns over a billion in big pharma stock, and failed to mention that when they came out HARD against the medical marijuana initiative. 

They make money off of sick people. And try to control what treatment those sick people can access. ",conspiracy,big pharma
2,They are BANNING BOOKS in parts of the US and not a single post about it has gained traction here. Free Speech is NOT a matter of convenience,8030.0,sh2zq9,https://www.reddit.com/r/conspiracy/comments/sh2zq9/they_are_banning_books_in_parts_of_the_us_and_not/,2501.0,1643640703.0,"There are a couple of sayings that get tossed around here:

> To know who rules you, simply find out who you are not allowed to criticize.

&
> Rules for thee, not for me.

As books are banned in conservative parts of America, for NOT BEING PATRIOTIC ENOUGH no less, where, I ask you, is the outrage over this silencing of books and voices that criticize America??

Why is free speech a rule that must be observed for some causes in America, and silenced for others?  Why are these ""approved"" causes for censorship so consistently associated with the right wing of politics? And why are they so consistently invoked to protect the power of the nation-state? 

Let me bring in a quote from another book about tyranny, one that has been banned again and again with no sense of irony – Fahrenheit 451.

> The books are to remind us what asses and fools we are.

This half-assed approval of free speech and dangerous half-acceptance of censorship is making asses and fools of us all.

Here's my most controversial take for this sub:

You cannot be merely conservative and think that makes you a conspiracy theorist.

This was never true, as conspiracy theories are fundamentally critical of the state and the political parties that control it. But not it is all the more important to wake up to the new development:

The conservative wing of the US government has, in a calculated fashion, captured the narrative of conspiracy theories in order to manipulate their voter base into action that serves their desire to amass and secure power.

If you are conservative and consume the media of conspiracy theories, you are now a demographic, endlessly studied and prodded by messaging campaigns, seeded narratives, and daily doses of programming — the bluest of pills — that is being manipulated to serve a class of elites who are in no way ACTUALLY interested in the supposed tenets of conservatism.  

* Small government is no longer in *their* interest, but they'll keep selling you a line as if it is.

* Dismantling the surveillance is no longer in *their* interest, but they'll keep selling you a line as if it is.

* Taking down Wall St. and Big Pharma are no longer in *their* interest, but they'll keep selling you a line as if it is.

* Putting an end to censorship is no longer in *their* interest, but they'll keep selling you a line as if it is.

Both Left and Right are utterly fooled by the media machine that gives the marching orders. This would ideally be a space that transcends that. But there are so so many of you still deeply asleep.

Either grow some actual convictions or simply accept being a partisan hack, an NPC, a sheep.",conspiracy,big pharma
3,"Trump Signs Four Executive Orders, Big Pharma Loses $150 Billion",7131.0,i5muyq,https://i.redd.it/8jap47m2inf51.jpg,1086.0,1596836817.0,,conspiracy,big pharma
4,"Congresswoman: ""Big pharma keeps pushing back against legalizing medical marijuana because, in many cases, they want to continue to sell addictive drugs and dominate the market for drugs that address chronic pain. That's wrong. """,5542.0,816qp8,https://twitter.com/SenGillibrand/status/968957563604799489,226.0,1519923508.0,,conspiracy,big pharma
5,Humans were never meant to eat three times a day,5437.0,s1ewdd,https://www.reddit.com/r/conspiracy/comments/s1ewdd/humans_were_never_meant_to_eat_three_times_a_day/,1492.0,1641913333.0,"That is why intermittent fasting is so beneficial. The body functions better and you have more energy with less food. People didn't have refrigerators or food readily available all the time a few centuries ago. They only ate when they had the opportunity. It was once a day or once every two days. They also didn't have refined sugars and carbs which makes you feel hungry all the time.

 If you don't consume refined sugars and carbs, you rarely get hungry. And you are full of energy all the time. Your brain fog will disappear and you will never need to drink coffee to feel alert.

Big pharma and big food are a match made in Hell. One is making you sick and addicted to their so called foods and the other keeps you sick with their prescriptions meds.",conspiracy,big pharma
6,"If you are reading this, you have to do 10 pushups 10 sit ups and 10 air squats for 3 sets. Your government does not want you healthy. Big pharma does not want you healthy. Big food does not want you healthy. Let’s put in the work.",5188.0,s06mg1,https://www.reddit.com/r/conspiracy/comments/s06mg1/if_you_are_reading_this_you_have_to_do_10_pushups/,599.0,1641776003.0,"Intermittent fasting. If you want to take control of your life and health/weight. Intermittent fasting. 

Humans were never meant to be eating processed insulin spiking garbage 8 times a day. Clean your body. Research.",conspiracy,big pharma
7,I warned you about DNA testing. You didn't listen.,5077.0,95lhhi,https://www.reddit.com/r/conspiracy/comments/95lhhi/i_warned_you_about_dna_testing_you_didnt_listen/,750.0,1533730618.0,"About 8 months ago, I told you guys that the ultimate goal of DNA testing companies weren't about making money from the actual tests but to build the most powerful database in the history of mankind.  A complete DNA database with matching names and addresses.   

Here's the original post.

https://www.reddit.com/r/conspiracy/comments/7g5kiy/are_you_a_fool_why_are_you_voluntarily_giving/?st=jkl3cj5z&sh=a766ab18


Some of you agreed.  Some of you mocked me.  No matter.  It is all coming to be now.  They already sold the database to multiple pharmaceutical companies.  

https://gizmodo.com/23andme-is-getting-lots-of-money-from-big-pharma-to-sha-1827891890



Now they are selling to insurance companies who will wade through the data to eliminate high risk people from the insurance pool.  

http://cbslocal.com/2018/01/18/taking-ancestry-test-makes-buying-life-insurance-harder/


This is just the beginning.  As we discover more and more about the inner workings of DNA, they will find more and more devious methods to exploit this data.  Soon, you will find yourself categorized under your DNA profile.  


I urge you to write to your Congressmen to make it illegal to sell this data.   I urge you to call these companies and complain.  This is no joke.  If you didn't take one of these tests, good for you.  For those that did, I feel for you.",conspiracy,big pharma
8,Harvard Study Finally Admits Drug Prices Are High Because Govt Grants Big Pharma A Monopoly,5052.0,4zx1kx,http://www.thelastamericanvagabond.com/conspiracy/harvard-study-finally-admits-drug-prices-high-govt-grants-big-pharma-monopoly/,306.0,1472343801.0,,conspiracy,big pharma
9,Reuters pushing big pharma propaganda,4642.0,omcq87,https://i.redd.it/o9hf34uq8sb71.jpg,474.0,1626555842.0,,conspiracy,big pharma
10,"Tulsi Gabbard Wants to Legalize Marijuana, Punish Big Pharma and End Private Prisons",4113.0,aq86mp,https://themindunleashed.com/2019/02/tulsi-gabbard-legalize-marijuana-punish-big-pharma-end-private-prisons.html,726.0,1550074450.0,,conspiracy,big pharma
11,"Left is right, up is down, nature is unnatural. Because nature doesn't generate Big Pharma trillions of dollars a year.",4086.0,l4sfmq,https://i.redd.it/v4cr4gezhid61.jpg,791.0,1611595064.0,,conspiracy,big pharma
12,Psych Meds Linked to 90% of School Shootings. MSM Never Covers this because it Messes with Big Pharma's Cash Cow,3842.0,7xlodh,https://www.reddit.com/r/conspiracy/comments/7xlodh/psych_meds_linked_to_90_of_school_shootings_msm/,760.0,1518645315.0,"http://www.wnd.com/2012/12/psych-meds-linked-to-90-of-school-shootings/

>Some 90 percent of school shootings over more than a decade have been linked to a widely prescribed type of antidepressant called selective serotonin reuptake inhibitors or SSRIs, according to British psychiatrist Dr. David Healy, a founder of RxISK.org, an independent website for researching and reporting on prescription drugs.

https://www.cchrint.org/school-shooters/

>Fact: At least 36 school shootings and/or school-related acts of violence have been committed by those taking or withdrawing from psychiatric drugs resulting in 172 wounded and 80 killed (in other school shootings, information about their drug use was never made public—neither confirming or refuting if they were under the influence of prescribed drugs).  The most important fact about this list, is that these are only cases where the information about their psychiatric drug use was made public.

I bet the Florida School shooter was also on these pills, but you won't see this ever mentioned because the Conspiracy is to keep America Drugged for profit",conspiracy,big pharma
