,title,score,id,url,comms_num,created,body,subreddit,query
120,Factcheck - the biggest conspiracy is happening right now,157.0,fvuhra,https://www.reddit.com/r/conspiracy/comments/fvuhra/factcheck_the_biggest_conspiracy_is_happening/,91.0,1586158970.0,"Hello thinkers,  
I am not an usual poster here, but I confess I am reading what have been posted here for some time. I like to investigate and I like to know as much as I can what is going on around me. I am a fighter, I am not a sheeple.  

I tried to post this on many other subs, forums, social media and it was downvoted to oblivion, removed, banned, ridiculed etc... you know the tactics to suppress the critical thinking, open mind and voice against tyranny. I think is a general feeling that this sub r/Conspiracy is the last place where we can still say what we have to say, in special in these hard moments that the whole planet is going through. And I think is also a tactic, they let us post here so it could be easy considered ""crazy bat shit conspiracy nut"". I am ok with that as far as I know that many other thinkers can read what am I about to say.  

**Thank you mods of r/conspiracy to let us say what we have to say.**  

So let's have a ""factcheck"" of the latest points of the greatest conspiracy of the all times: New World Order is about to take over, the End Game that we all know about that will come and we warned about.  
In a conspiracy, to prove it that is real and not a conspiracy anymore we need to answer 4 questions: who, why, how, when

1. **Who: Rothschild, Rockefeller, cabals** etc   
It was posted here so many links, documents, videos, confessions about these, we already know WHO they are.  
But we have to mention also that they have accomplices, the ones that are executing their plan: banksters, WHO, high level governments (including chinese and russian), UN, NATO, few high level people in big corporations (and in special the big pharma), actors and media. All these accomplices, we already know that they were convinced, blackmailed, brainwashed and so on to participate into this evil plan.  

2. **Why: to convert the population into a mass modern slavery, that will obey and produce for them**  
For decades now, we were bombarded with bullshit slogans like ""we are too many on this planet, we have to act now"". That was the plan and we already know how they push it. To sustain THEIR lives and power, they do not need 8 billion people/sheeple/slaves, they just need few millions, obedient and totally controlled. And slowly many of these could be replaced with robots, AI, automation.  

3. **How: reducing the population to a number that can be more easily controlled**  
For many hundred of years they tried in many ways: wars, diseases, experiments, chemtrails, weather control, birth control, now spreading false viruses and conducting worldwide hoax induced by FEAR. They still have many ""weapons"" to release... they can't kill over night 8 billion people. **We are too many, still**.  
Here I will extend a bit, just to see that this part is IN EXECUTION NOW.  

- Factcheck: for decades they were creating regional wars and instability in many places around the globe, sometimes for no logical reason. This was creating massive migrant exodus and bring fear, instability, diseases, crimes etc.  
- Factcheck: for decades they were creating various weapons for mass destruction, in labs and then release them: viruses, diseases, infections, HARP, chemtrails, 5G.  
- Factcheck: right now they released the ultimate weapon and plan - COVID-1984 and reduce the population at 50%  
1. There is something that is not proved 100% that seems to act as an infection (but not really is) that seems to be activated in 5G proximity  
2. It is clear now that this ""infection"" is not a virus, it is presented like that to put people in FEAR mode. But now we have probes that could be easily detected as an exosome that we all have regularly in our bodies. it is clear now that these exosome combined with fear and other illnesses can create a chain reaction and people die.  
**Yes, there is no hoax, people die in hospitals, but that doesn't mean they are dying BECAUSE of COVID-1984. There is no proof for that.** In fact this is their plan, to kill as much as they can. They started with the most vulnerable: old, sick, weak.  
3. Now come the 2nd wave of deaths: those that are not old, sick, weak. **Those that will be infected in the ""TESTING"" PROCESS**. Yes you hear it here: the testing process will be actually the grand operation to literally infect people with a deadly pathogen. Medical staff doesn't know anything about this, they are innocents and they will die many also.  
They are preparing now, large places with medical tents, where people will be forced to be ""tested"" for the so called COVID-1984, **but in fact those tests contain the deadly pathogen**. With the inserting the deadly pathogen, you will be declared ""INFECTED"" and isolated in special facilities (already in place, that's why there are empty now). Once you are isolated, in few days you will get the symptoms and you will be put in hospital bed for ICU, but the medical staff will not be informed how to treat it, they will have false information and people will die anyway. Medics now start to see things that doesn't make sense and those who dare to say something will be ELIMINATED.  
**YES PEOPLE WILL DIE WITH MILLIONS** But wearing a mask or isolate in house, will NOT protect you in any case. **THIS IS THE FUCKING LIE, TO KEEP YOU CONTROLLED AND QUIET, until their plan can't be reversed**  
4. 5G installations are going fast now, but remember: are NOT activated on full power until are everywhere. Will fool people that start now to protest against, they will release a non-lethal frequency to ""prove"" you that is OK. Later will beam the hell us and people will fall like flies.  
5. Those selected NOT to be infected or get immune, will be anyway forced vaccinated with ID2020.org and later totally controlled with 5G. Those will be the modern slaves that will continue to serve the masters.  

4. **When: NOW, it's happening right now, under your eyes. There's no more time to investigate and do nothing.**  
Is time to wake as many we can. We are still much more then them. We are still billions, they are just few.  
First we need to get the medics, from the 1st line to speak, freely, openly, with big balls. Yes it is a huge risk for them, but there's no other option anyway, they will die soon too.  
We need more specialist to speak (we already have more than 20 yelling as much as they can on social media). But we need more, the medics in hospitals, don't be afraid, come up and say what you have to say, don't fall into their trap. We know that many are there in fear and do not dare to speak. We will support you in every possible way.  
  
The question is: **YOU WANT TO DIE AS A SLAVE SHEEPLE OR AS A FREE MAN?**  

We need to wake up police and army, as many is possible. They are few, those who will still remain with NWO plan, will be less, we are still many,. What they are going to do? To arrest us all? Where to put billions of people in jail? To kill us? We will die anyway soon, so we have NOTHING to lose. We are NOT afraid of any ""infection"", we already know that the infection is WHEN they put something into your body, not from the air/touch. Maybe later they will come with a airborn pathogen, as an ultimate chance for them, but in this moment there's NO risk.  

We need to organize and get out, massive protests and force governments to be responsible and pay for all the damage. We can reverse this into OUR TIME, OUR PLAN towards FREEDOM. **ENOUGH IS ENOUGH.**  

EDIT: I will encourage everybody reading this to watch the latest interview on London Real of David Icke: https://youtu.be/-3XlrQMOvW0 Even if you disagree 100% with what David was saying for 30 years, at least listen him now to see his message.",conspiracy,5G
121,Looks like Israel is not getting 5G,158.0,bw3i9y,http://www.radiationdangers.com/5g-roll-out/well-whaddya-know-no-5g-for-israel/,46.0,1559516470.0,,conspiracy,5G
122,COVID-19 is a Global 9/11,156.0,g2pslh,https://www.reddit.com/r/conspiracy/comments/g2pslh/covid19_is_a_global_911/,24.0,1587077912.0,"Here are the parallels I see:

No matter whether you believe the official story on 9/11, or that it was an ""inside job"" here are some things that are undeniably true. In its aftermath, as the public was in a state of distress, the U.S. government took upon massive, harmful programs that otherwise never would have been accepted by the public. These include **The Patriot Act** and the **$7 trillion wars in Iraq and Afghanistan** (and we're still in Afghanistan).

Now, as the COVID-19 pandemic rages on, as the world is in a state of distress, whether you think it is a natural disease or a bio-weapon, world governments are taking action, which, under normal conditions would never be acceptable. These include **full lock-downs** which may last for months, **full-on travel bans**, and **universal basic income**. Now, some of these measures, I believe, are going to be permanent in less severe forms than they are now. Take the travel bans. I don't believe air travel will ever be like what it was before COVID-19.

Just like after 9/11 in America, there are going to be extra requirements put in place. I fully expect countries around the world to require foreign travelers to either **get tested for COVID-19** or **prove that they've been vaccinated** against it before being issued a visa or allowed entrance.

Just like after 9/11 in America, there are going to be new surveillance systems put in place. Governments around the world are going to follow China's lead, and we're going to see systems put in place to **geographically trace** those who've been infected through their phones and the disease will be mapped in that way permanently. We're going to see **drones** that sense people's temperatures in the street. We are going to see COVID-19 vaccinations show up on people's **credit scores or background checks**. For this pandemic and the next.

And we're going to see something new: **Universal Basic Income**. The service industry has been destroyed overnight, and it's not coming back soon. The same applied to the events industry, which includes music concerts, sporting events, markets, retailers, shopping malls, and so on. Millions upon millions have been put out of work and will continue to be unemployed and underemployed. Some form of UBI will be implemented on a more **permanent  basis** all around the world. I believe that the purpose of this is to further destroy the more natural, community based small-business and independent economy. People will have just enough money to get food and a cell phone and streaming services, and simultaneously be demotivated to start their own independent endeavors. Those mega-companies like Amazon and other tech firms and delivery services, which have already decimated communities all over America, are only going to grow stronger.

Those are just some of the things that have occurred to me off the top of my head, I'm sure there are many more different and terrifying things to come. There are some dark days ahead, but we must remain vigilant and pay attention to every single way the TPTB are and will continue to take advantage of this situation in an authoritarian and elitist fashion.

EDIT: on the 5G issue, I don’t think it’s causing the coronavirus. The real reason we’re seeing the rollout of 5G infrastructure alongside the pandemic is because the surveillance systems that are being developed in response to COVID-19 are going to leverage its capabilities.",conspiracy,5G
123,The UFO topic is HOT now. Please review project BlueBeam or any of the following so you don't get caught by the propaganda,158.0,o9cbyu,https://www.reddit.com/r/conspiracy/comments/o9cbyu/the_ufo_topic_is_hot_now_please_review_project/,111.0,1624852165.0,"* CIA Project BlueBeam.
* Moon landing hoax and how CGI influences people's opinion about the universe.
* Technology for getting on the Moon - LOST. Technology for getting on Mars - Sure, why not?
* SpaceX / NASA - The best CGI technology in the world or is it China / Japan? ...
* Alien invasion commercialized by Ronald Reagan, the X-files, the ""history"" channel, and all sorts of predictive programming.
* Actual laws for alien invasion and actual space defense force already being established.................. Seriously, I wish I was kidding.
* CIA documents knowing for decades about UFO's and JUST NOW decide to reveal them???
* CIA documents now mention UAP - Unidentified Aerial Phenomena to avoid UFO labels...
* MK Ultra victims speaking out that the last card for the New World Order is an alien invasion.
* Majestic 12 documents talking about the New World Religion which the aliens will ""reveal"" to us.
* Every single culture before us speaking about DEMONS but the last 70 years, the media changes this to ""aliens""? :D Every occult book reveals a little truth - they never mention aliens though.
* How many Satanic Secret Societies do you need to confirm this? The Knights of the Temple of Solomon / Order of Jesuits / Ordo Temply Orientis / Masons (only about 33rd degree) / Illuminati / etc
* Do you know what sophisticated holograms need - a very stable internet connection. Some might call it 5G. Others may call it 6G - depends how much you research on that.
* CIA projects involving electromagnetic waves influencing the brain and its functions revealed by the Freedom of Information Act decades ago. How advance do you think they have become?
* What would a vaccine or injection have to do with it? What would cryptocurrency and market failure have to do with it? What would ""climate change"" or HAARP have to do with it? What would lockdowns and censorship have to do with it? Do you even see the big picture?
* How about depopulation agenda 201? How about Bill Gates' presentation on the ""virus"" killing so many and he ""coincidentally"" investing so much money in vaccines where he has 0 medical knowledge?
* How about being ready with a vaccine after just one year of almost non-lethal ""virus""? Anyone caring about the long-term effects here? Influenza shot was terrible choice, why trust a new ""vaccine""?
* How about the general push of fake information and fake sources or the CIA call it - operation Mockingbird, so you grow skeptical of everything and you don't believe anything you hear or see anymore? ""Too much information, bro. If that was true - more people would speak out about it."" / ""Trust the science"" / ""We must tackle online misinformation because it is dangerous"" - anyone of these sound familiar?
* What if this situation was already predicted? ""*And he causes all, the small and the great, and the rich and the poor, and the free men and the slaves, to be given a mark on their right hand or on their forehead, and he provides that no one will be able* ***to buy or to sell***\*,\* ***except the one who has the mark***\*, either the name of the beast or the\* ***number of his name***\*. Here is wisdom. Let him who has understanding calculate the number of the beast, for the number is that of a man;\* ***and his number is six hundred and sixty-six*** \- Revelation 13:16-18 / 18 = 3 x 6"". Is that some nonsense bs or patent number 2020060606 filed by Microsoft just before the covid news? Why don't you check and find out?
* Georgia Guidestones showing a project for world domination where 90-95% of the CURRENT population is not even counted... No one knows who build them. Unless you read the book...

&#x200B;

It is proven that a person in fear will react by reflex and prioritize the major event instead of looking at the big picture. DON'T BE THAT PERSON. Don't be controlled by fear. Just calmly review what I've shown you now and calmly provide the sources to those around you. Our positive interactions with others give us spiritual power - this is a fact that anyone can prove today. Use your power and don't stay silent! Because in the time of censorship - you must speak the loudest!

&#x200B;

Oh, just to throw-in the future war between Israel and Iran - Do you know about the bombings in surprisingly every country around Israel? I know you didn't. / China and Hong Kong, Taiwan, the next country they declare, as the tyrants they are, as theirs, and eventually India - have you heard how much military assistance does your country give to India? You should! / USA news is just Zionist propaganda - oh, did I wake you on that subject? Anyone of these networks wants you to rebel - to go out and damage instead of help others... How about you fkin help? You can do that today! Just talk to someone, prepare your facts so they see reason and proof of your words, don't quit on people! When the situation around you is terrible and no one acts - that means that you have to act, but not by damaging someone... wake someone up today!",conspiracy,5G
124,5G networks will use the same frequencies as pain-inflicting crowd control weapons,158.0,753cix,http://emrabc.ca/?p=11899,75.0,1507486481.0,,conspiracy,5G
125,Switzerland's citizens already feeling the health effects of 5G,151.0,fbxqhx,https://www.reddit.com/r/conspiracy/comments/fbxqhx/switzerlands_citizens_already_feeling_the_health/,92.0,1583085382.0,"[https://mdsafetech.org/2019/07/20/the-first-report-of-5g-injury-from-switzerland/](https://mdsafetech.org/2019/07/20/the-first-report-of-5g-injury-from-switzerland/) \- updated 2/29/20

[https://www.altermedicine.org/sideeffects-of-living-near-5g-towers-in-geneva-switzerland-testimonial/](https://www.altermedicine.org/sideeffects-of-living-near-5g-towers-in-geneva-switzerland-testimonial/)

Apparently the news that Switzerland was banning 5G was misleading, rather they stopped building more towers but planned to use the existing towers for the 5G launch last week.

This means that most of Switzerland's cities have a 'thinned out' coverage and yet citizens are already reporting-

*""As soon as the antennas were installed, several residents and entire families in the heart of Geneva reported similar unusual symptoms of loud ringing in the ear, intense headaches, unbearable earaches, insomnia, chest pain, fatigue and not feeling well in the house.""*

A quote from a Geneva resident - *""The day after the 5G antennas in Geneva started working, I had headaches  on my left side, severe chest pain in my heart and very loud and acute  whistling in my ears. All this was totally new to me, I’ve never  experienced these pains before.""*

&#x200B;

Conspiracy theory's aside, there's hundreds if not thousands of reputable people in medicine, science, engineering, technology and military all singing the same tune, 5G is dangerous to human health, and should be banned or at least tested properly.

Why are the governments ignoring these people? For faster Internet speeds? I mean come on when in the last 5 years have you really thought your Internet is too slow. The 'Internet of things' is spoken about often, with self driving cars and drone networks. Great, but if it's hurting people it's not the way to go.

Thoughts? Do you think this is a case of individual companies competing to be the first to release the tech as is the way in a competitive market - or is there something more sinister behind this?",conspiracy,5G
126,Doctors/Experts Call for Delaying Deployment of 5G Due to Health Risks,155.0,cvz8ne,https://mb.ntd.com/doctors-call-for-delaying-deployment-of-5g-due-to-health-risks_339335.html/amp,27.0,1566879113.0,,conspiracy,5G
127,"This just popped up down the street..wasn’t there last weekend. Wasn’t on the 5g bandwagon myself, should I be concerned?",153.0,fvom7j,https://i.redd.it/v5yjwqcwc3r41.jpg,171.0,1586132552.0,,conspiracy,5G
128,"Admins Announce Plan to Target ""Misinformation"" on Reddit: Prompted by COVID-19, this will also apply ""to all types of misinformation""",151.0,g2ivpn,https://www.reddit.com/r/conspiracy/comments/g2ivpn/admins_announce_plan_to_target_misinformation_on/,49.0,1587056558.0,"**[Reminder to Help Us Preserve This Space](https://old.reddit.com/r/conspiracy/comments/c69gcb/help_us_preserve_this_space_report_all_calls_to/): Report ALL calls to violence and other violations of the Reddit User Agreement**

Please make sure to review the [User Agreement](https://www.redditinc.com/policies/user-agreement), as well as Reddit's [Content Policy](https://www.redditinc.com/policies/content-policy?utm_source=reddit&utm_medium=usertext&utm_name=conspiracy&utm_content=t1_erm7az4).

Here are some noteworthy passages from a recent admin announcement, which is directed at moderators side-wide:

>The situation on the ground is constantly changing and so we are trying to strike a balance of acting quickly on claims that might cause or encourage violence or physical harm (such as advice to drink bleach, or calls to vandalize phone towers), while ensuring that you, as mods, have the necessary resources and support you need to set appropriate standards for your individual communities.

>We know you already have your hands full, so please know that you are not on the hook to be able to verify every piece of COVID-19 information that passes through your subreddit.

>We will work closely with moderators if we see misinformation regularly cropping up in their subreddits. Unless the subreddit is dedicated to misinformation, our goal is always to start with education and cooperation and only escalate to quarantine or ban if necessary.

>In the coming weeks, we’ll be adding misinformation as a proper option in the reporting flow for all users.

When pressed for clarification about whether this referred to COVID-19 misinformation specifically, this was the reply:

>This applies to all types of misinformation. Our post today is not about changing any policies - we’re addressing Covid specifically because we know it is affecting all of your communities right now. We wanted to reiterate what we’re doing our end as well as give you as moderators and users a way to report what you’re seeing so we can investigate.

So, how might this affect /r/conspiracy? 

It shouldn't, as long as we continue doing exactly what what we've been doing. Keep reporting *all* calls to violence, and this *absolutely* includes any semblance of encouragement for the destruction of property (ie 5G equipment).

Fortunately, we have a passionate and robust user base, and a dedicated mod team, and we are proud to boast [limited admin involvement](https://old.reddit.com/r/conspiracy/wiki/transparencyreports) over recent months. 

Indeed, despite the routine attempts to paint this community in a poor light, largely due to [the semantic manipulation of the word ""conspiracy"" itself](https://old.reddit.com/r/conspiracy/comments/fpycie/why_is_rconspiracy_still_around_the_answer_may/), this forum is still, unequivocally, **""dedicated to free thinking and for discussing issues which have captured your imagination.""**

As stated by a member of the mod team:

 >On /r/conspiracy, we have always held the position that we, as mods, make NO PRETENSE of being the arbiters of what is or is not ""truth"", and doing so would contradict the very foundations on which this sub was built, and what makes it a truly unique forum on Reddit.""

That being said, we recognize that the Reddit admins are free to decide what content to restrict on their website, and this includes material they deem to be ""misinformation.""

To reiterate: Even with these new guidelines, there's no reason admin intervention on /r/conspiracy can't be kept to a bare minimum. 

In addition, there's no reason why this should affect our ability to entertain all manners of ""high octane"" speculation (the raison d'etre of this sub!), as healthy hypothesizing is a far cry from the actual spreading of misinformation, unwittingly or not.

As long as we keep reporting and removing content with harmful intent or repercussions, /r/conspiracy should remain in compliance under these new guidelines.

Stay safe out there, and happy speculating!",conspiracy,5G
129,5g scares the hell out of me,146.0,ab2tbt,https://www.reddit.com/r/conspiracy/comments/ab2tbt/5g_scares_the_hell_out_of_me/,149.0,1546224103.0,"I've reached the point where I'd actually be relieved if the worst thing about 5g is that it's going to be used to spy on everyone and then in rare instances used as a weapon against people trying to overthrow the regime . What scares me is that 5g is going to be used to slowly kill off a large number of people through radiation. Animals and plants will die. Cancer, dimentia, depression, and every sort of illness rates will skyrocket. Everyone is going to feel like shit all the time. And there's nothing we'll be able to do about it ",conspiracy,5G
