,title,score,id,url,comms_num,created,body,subreddit,query
0,"One of the most important interviews on the Internet just got even more important, because of the pandemic, now the jigsaw of the plan for the future is almost complete, and the head architects are surely the Rockefeller Family.",5223.0,fs4sxj,https://www.reddit.com/r/conspiracy/comments/fs4sxj/one_of_the_most_important_interviews_on_the/,1180.0,1585622275.0,"First here's a brief version of the post summed up quickly:-

1. Decades ago a highly credible investigator, Norman Dodd, discovered that the tax-exempt foundations e.g. Rockefeller Foundation etc, wanted to make changes to society, and their tool of choice (at that time) was war.

2. The tax-exempt foundations said they would continue to use war until they had other effective methods for making major societal changes.

3. 10 years ago, a high-level Rockefeller document described details of other methods for influencing how the world evolves, one such scenario which was suggested in the document was a pandemic.

4. What societal changes do the Rockefellers desire? 
A former Rockefeller family friend blew the whistle on the plans the Rockefellers had for the future.  He was told they want everyone chipped for tracking and to buy/sell.  If they don't like you they will turn off your chip to make it incredibly difficult for you to function in society.

Conclusion:-  The Rockefellers no longer rely on war to make changes in the world, now they have other tools at their disposal, such as pandemics.  Their goal is take away our freedoms, then if we want them back we'll be forced to receive vaccines to gain a digital certificate of movement which allows us to be tracked on 5G control grids. Over time it will be placed onto a chip, which will be hard to avoid. By then society will be cashless, making life without a chip a struggle, almost impossible.

Chief suspects for causing this pandemic = Rockefeller family and their many proxies.

Longer version with more detail:-

[This interview](https://www.youtube.com/watch?v=8RgRGWlDo70) with the late [Norman Dodd](https://en.wikipedia.org/wiki/Norman_Dodd) was already viewed as one of the most important on the Internet.  If you haven't seen it before, you really must add it to your list.  Dodd was the chief investigator of the Reece Committee, his job was to look into the tax-exempt founds e.g. Rockefeller Foundation, and to find out what they were actually up to.  In the interview he explains that the foundations are really there to make changes in the world, and that the only way they know how to make changes is through war, so their job is really to start wars.  Since war was the only effective method they knew for making major changes, they would continue to use it until they had other equivalently effective methods.  

10 years ago the [Rockefeller Foundation released a scenario document, Page 18](https://www.nommeraadio.ee/meedia/pdf/RRS/Rockefeller%20Foundation.pdf), where they looked into different scenarios which could influence the way in which our world evolves, one of the scenarios analyzed was a pandemic.  So what we're seeing here, is that over the decades the Rockefeller Foundation has moved on, they no longer rely on war as a tool to make changes, now they have new tools at their disposal, like pandemics, making them the chief suspects as to who has placed the world into the current pandemic scenario.

Now, you may be wondering what kinds of changes the Rockefellers want to make to society, well one of their [former friends blew the whistle](https://www.youtube.com/watch?v=9dzzBix1NdU) in a video of similar importance to the Norman Dodd interview.  Aaron Russo was a filmmaker and a close friend with one of the Rockefellers.  Aaron was told their secret plans for the world, which included everyone being micro-chipped in a cashless society, where one requires an implanted micro-chip for buying and selling.  If TPTB didn't like what you were doing they could switch off your chip, making it almost impossible for you to function in society.

So, as Bill Gates (who is allied with the Rockefellers) recently [admitted on Reddit](https://np.reddit.com/r/Coronavirus/comments/fksnbf/im_bill_gates_cochair_of_the_bill_melinda_gates/fkupg49/), the plan is for people to have digital certificates of movement, Germany is calling them [antibody certificates](https://www.businessinsider.com/coronavirus-germany-covid-19-immunity-certificates-testing-social-distancing-lockdown-2020-3?r=US&IR=T).  It's very easy to see how these digital certificates of movement, initially on your smart phone, will eventually be installed on implanted micro-chips, in case you lose your phone and for your convenience, they will say.  You won't be allowed in society without one, as they will claim you may spread a virus, for you to be allowed out in public they will force you to have this, which also means receiving the vaccines and whatever ingredients eugenics enthusiasts Gates and the Rockefellers decide to put in them.

Last but not least, the 5G control grid which is being rapidly rolled out is there to track your movement by connecting with the digital certificate/chip, this is why 5G is being prioritized despite there being so much public resistance and unknown health risks.  While 4G was similar, it is nowhere near as fast and cannot make as many connections, with 5G they can track us in real time.

How can the Rockefellers be stopped?  

The perfect thing about their plan is that they can keep on attacking us with wave after wave of pandemic until we give in.  That means to stop them we need high level people in the world to get onboard, deciding enough is enough.  There needs to be arrests and all their essentially terrorist operations must be shut down once and for all, the Rockefellers and Mr Gates can no longer be tolerated as being above the law.",conspiracy,5G
1,So my local council have started putting up 5G antennas. Not dodgy at all,3748.0,bvban5,https://i.redd.it/g8hjui6vdl131.jpg,679.0,1559328219.0,,conspiracy,5G
2,"Can an entire country be labelled ""crazy conspiracy theorist""? - ""Switzerland halts rollout of 5G over health concerns""",3283.0,f5wsr3,https://www.ft.com/content/848c5b44-4d7a-11ea-95a0-43d18ec715f5,479.0,1582052542.0,,conspiracy,5G
3,"The ridiculous news stories of ""Shortages"" to ""Student Walkouts"" to ""Strikes"" to ""Hospitals are Maxxed"" to ""5G Grounding Flights Maybe Permanently"" are ALL cover for what's really happening. Employees are telling their companies to fuck-off over mandates and the liar MSM is tripling down.",2784.0,s7nyic,https://www.reddit.com/r/conspiracy/comments/s7nyic/the_ridiculous_news_stories_of_shortages_to/,496.0,1642591225.0,"The fake news stories are unreal these days. Yeah bus drivers are on strike because of three bizarre reasons and none of them listed are vaccine mandates. LOL.

Another clown show printed this week was that students at a university ""staged a walkout"" over ""Covid policies that make them feel unsafe.."" (wtf?) Sure..

And the Bus Driver ""shortages"" are causing delays. 

Further, this jackwagon of bullshit they are shoveling on the 5G and airplanes is another fake. First of all, flights have been operating in Europe with no issues. Second of all, as if anyone is buying the technical explanations about altimeter misreads. They KNEW this was coming, so it's absurd to think they would **not have this figured out already**??. It's obvious this is cover for pilot walkouts over forced vaccination mandates. 

Same with whatever excuses they are shoveling on the Trucker Shortage. There is BARELY a mention of the truckers blocking the Canadian border due to mandates, but they'll fill six walls of text with lies about ""the situation"" while avoiding the glaring truth. It's all so tiring. Cheers.",conspiracy,5G
4,"Bill Gates lets slip the real reason for the Pandemic i.e. Digital Certificate Of Movement, initially on your smart phone. Reading between the lines, this will be so as you are tracked on the 5G control grid and require compulsory vaccinations to keep your certificate valid.",1670.0,fkzyui,https://www.reddit.com/r/conspiracy/comments/fkzyui/bill_gates_lets_slip_the_real_reason_for_the/,378.0,1584575644.0,"Before we look at what he said and put it into context, here is the outline of what this is for and where it fits in:-

1. The Pandemic is initially to restrict our movement, removing our freedom.

2. To regain movement, we will require a digital certificate of movement on a smartphone (eventually on a microchip under the skin).

3. The microchip will be for buying and selling, it will be switched off if you protest TPTB.  In a cashless society you won't be able to function.

4. The 5G network is to track you, initially by your smartphone which you have to bring everywhere due to the digital certificate of movement, and eventually on your microchip.

5. End Goal - Total Enslavement, the Deep State want to own us like cattle on 5G control grids, they can switch us on and off as they wish.

Here is what [Gates said today](
https://old.reddit.com/r/Coronavirus/comments/fksnbf/im_bill_gates_cochair_of_the_bill_melinda_gates/fkupg49/):-

""Eventually we will have some digital certificates to show who has recovered or been tested recently or when we have a vaccine who has received it.""

The article below discusses the certificate of movement now required in France.

[Coronavirus containment: the certificate of movement on a smartphone](https://www.en24.news/a/2020/03/coronavirus-containment-the-certificate-of-movement-on-a-smartphone-practical-tip.html)

""Due to the coronavirus pandemic, France is placed in almost total containment and the population now needs a certificate to move. But not necessarily need a printer, the smartphone is enough.""

To understand the broader context of the digital certificate of movement, it's useful to go back over 10 years to an [interview with a former friend of the 'Deep State' Rockefeller family, Arron Russo](https://www.youtube.com/watch?v=FIolXnOG96g).  In the interview he exposes the plans which a member of the Rockefeller family had leaked to him in private.  One of the most important pieces of information was that in the future all humans would be required to have a microchip under their skin, and one of its main purposes would be for buying and selling.  Any individual resisting the agenda of the Deep State would have their microchip switched off, making it almost impossible for them to function in society, thereby giving The Elite immense control over the population.

Note: The Rockefeller family have also been [obsessed with pandemics](http://www.nommeraadio.ee/meedia/pdf/RRS/Rockefeller%20Foundation.pdf) (page 18) for years [like Bill Gates](https://www.youtube.com/watch?v=jDxb21qIilM).

Of course, to keep your certificate of movement valid, you'll need to keep up with your toxic social engineering vaccines, which will modify your fertility, IQ, lifespan, health etc in adverse ways, all under the guise of protecting you against various pathogens.  Both the Rockefeller's and Gates are known eugenicists, and are both heavily involved with vaccines, and both have admitted on video that they want the global population down to below one billion.

As you'll see, it is vital to resist the plans of these parasites, do not comply, if a significant % refuse to cooperate with their agenda then their agenda will fail.

TLDR - Reason for pandemic = Pretext for introduction of certificate of movement, so as we have to join vaccine social engineering program, get tracked on 5G grid and buy/sell with a microchip; fully enslaved by the Deep State.  It is essential for yourself and future generations that you refuse to comply.

Background videos:-

[David Rockefeller talks about over population and population control](https://www.youtube.com/watch?v=4tMOtR9qrRg)

[Bill Gates wants depopulation, will use vaccines](https://www.youtube.com/watch?v=iMl0ty6evhU)

[Event 201 - Did Bill Gates & World Economic Forum Predict Coronavirus Outbreak?](https://www.youtube.com/watch?v=mx8xKcQMTRs)

[Rockefeller Foundation Plan](https://www.youtube.com/watch?v=ehTr6P5d4-E)

Background Reading:-

[The ID2020 Alliance: The Global Totalitarian Project Hiding Behind The Vaccine Drive](https://www.ageofautism.com/2019/10/the-id2020-alliance-the-global-totalitarian-project-hiding-behind-the-vaccine-drive.html)

[Rockefeller Foundation Scenario Planning Document, see page 18](http://www.nommeraadio.ee/meedia/pdf/RRS/Rockefeller%20Foundation.pdf)",conspiracy,5G
5,"Hundreds of Bees Drop Dead Around ""5G Towers"" In California",1525.0,cl6hgz,https://i.redd.it/d8mrwidkc2e31.png,268.0,1564763817.0,,conspiracy,5G
6,Veteran journalist fired after criticizing 5G and questioning it's safety,1514.0,9m7hof,https://medium.com/@dvorak/5g-got-me-fired-ce407e584c4a,156.0,1538937472.0,,conspiracy,5G
7,"The ""5G causes Corona"" idea, has been manufactured to make anyone opposed to 5G towers seem like idiots.",1474.0,hhe87m,https://www.reddit.com/r/conspiracy/comments/hhe87m/the_5g_causes_corona_idea_has_been_manufactured/,380.0,1593350371.0,"Title says a lot. There are many reasons to be sceptical of the installation of 5G. With 5G cell data, your devices can be tracked down to the centimetre, and this level of detail in tracking is highly exploitable. This is the reason I'm skeptical of 5G, especially when 4G is as good as it already is.

There has been initial opposition to 5G towers, but they were quickly overrun by the people claiming that ""the 5g towers would cause cancer and corona"" . This has made it totally impossible to even discuss the existence of these towers without people instantly branding you insanely paranoid.

I find it all suspicious, and now the towers are being built all over.",conspiracy,5G
8,This has to be money laundering at this point right? Billions every week to other countries but none to help the U.S.,1424.0,xohccy,https://i.redd.it/y762plam07q91.png,513.0,1664193734.0,,conspiracy,5G
9,5G has arrived.... let's discuss... 📡,1403.0,yn7odm,https://i.redd.it/lx2sknssx8y91.png,1097.0,1667685701.0,,conspiracy,5G
10,Does anyone else find it weird that global protests against police forces pop up just weeks after governments show off their social distancing surveillance technologies? Anyone find it weird that a few weeks ago the US spent millions on riot gear? No one else has realized this?,1240.0,gxn7m1,https://www.reddit.com/r/conspiracy/comments/gxn7m1/does_anyone_else_find_it_weird_that_global/,213.0,1591432380.0,"I cant be the only one noticing...

How the government spent millions on [riot gear,](https://nypost.com/2020/05/18/federal-government-buying-riot-gear-amid-coronavirus/?utm_source=reddit.com) just weeks before global protests and riots break out. Countries spent millions on ""social distancing"" monitoring technologies while they were in the middle of a major economic crisis due to seemingly overblown pandemic.

We saw [drones](https://www.youtube.com/watch?v=mmryPT7PXn4&t=52s) that can monitor temperature and signs of illness.

We saw [cameras](https://youtu.be/EyuyvNj6R-c) that track your movement and distance from others placed on street corners.

We saw [Robo-Dogs](https://www.youtube.com/watch?v=pz7A8Umw5zY) enforcing social distancing.

&#x200B;

Anyone else find it weird that the US president is moving to classify a group that's claimed to be ""and idea not an organization"" as a terrorist group? Whether you like or hate Antifa it should bother you that being able to link you to ""an idea"" gives the government the right to declare you a terrorist threat. Especially considering that the previous president signed the [National Defense Authorization Act,](https://www.aclu.org/press-releases/president-obama-signs-indefinite-detention-bill-law) which allows the government to indefinitely detain you with out trial under the suspicion on being a terrorist.

&#x200B;

Isn't it weird that we saw a heavy pushback against 5G conspiracies as the towers started going up, simplifying it to ""conspiracy theorists think 5G cause Covid"" when in reality the earliest criticisms of it were about [privacy and tracking](https://www.insidehook.com/article/news-opinion/5g-the-good-the-bad-and-the-data-privacy-issues) concerns.

&#x200B;

Isn't it weird that these protests and riots seem to be corporately sponsored? How about the politicians, celebrities, and main stream media outlets that seem to be encouraging it. Racism exists and Black Lives Matter, but this movement has been hijacked by powerful outside forces...isn't it odd that saying something like that could get you doxed as a racist and people are encouraged to target you?

&#x200B;

Isn't it weird that while both sides of the media seem so hell bent on using whatever they can from the protests/riots to make the other side look bad, they refuse to talk about what went down in DC on Monday. Isn't weird that after online reports of people storming the white house lawn the [media](https://i.imgur.com/Kb8Sv1Y.jpg) stopped covering it, the live streams went down, and rumors of the internet and phones of people in the area going down started spreading? Isn't it weird that news outlets called DCBlackout a Hoax, when we have a [few pieces](https://www.youtube.com/watch?v=EbRof2PJAts&t=3s) of [video evidence](https://www.youtube.com/watch?v=-1dclnslDmQ) of [something](https://www.youtube.com/watch?v=TZsAmfXvyb4) going [down](https://www.youtube.com/watch?v=FbNq6cna6qg). Isn't it weird that Twitter[banned accounts](https://news.yahoo.com/george-floyd-protests-twitter-bans-130446689.html) posting about it, and blasted out thousands of [identical bot posts](https://i.imgur.com/1w1JJpF.jpg)discrediting it?

&#x200B;

Isn't it weird that while the media tried to paint Bill Gates as a pandemic prophet, they never mention [Event 201](https://www.centerforhealthsecurity.org/event201/about) which happened in October of last year? Isn't it weird that this pandemic simulation exercise, where they frequently mentioned a new normal, was [nearly identical to Covid 19](https://www.centerforhealthsecurity.org/event201/scenario.html)'s response? Inst it weird that it also had a section discussing using [social media/internet blackouts](https://youtu.be/LBuP40H4Tko) to deal with civil unrest and misinformation? Does it bother you that now, with the US out, Bill Gates is the [largest donor and influence](https://www.politico.eu/article/bill-gates-who-most-powerful-doctor/) of the World Health Organization. Isn't it weird that he is such a powerful figure within the UN that has its own global governing [agenda](http://agenda21news.com/category/agenda-21/)?

&#x200B;

Have you seen the advanced [technology in military](https://www.youtube.com/watch?v=v3OPUh2gOdo&t=26s) robotics? Imagine what they're not showing us. Have you seen the [city surveillance system](https://www.youtube.com/watch?v=fVDvJCeCe54) tested in Camden NJ in 2015? Does it bother you that 5 years ago they claimed soon every city will have it?

Knowing all this isn't it weird that there seems to be a global push to disband police forces?

&#x200B;

I think its really fucking weird.",conspiracy,5G
