,title,score,id,url,comms_num,created,body,subreddit,query
61,Theory: Marijuana Disrupts Mind Control Programming,334.0,cxilr1,https://www.reddit.com/r/conspiracy/comments/cxilr1/theory_marijuana_disrupts_mind_control_programming/,228.0,1567179496.0,"This is a topic that I haven't really seen discussed much. I wanted to throw it out there to get feedback from others and to get their thoughts on this theory. Lately, I've been doing research into brainwaves, EMF, etc. and their effects on humans. Most of us are aware that technologies that emit EMF radio like 5G, Wifi, cell phones, Television etc. There has already been research done that proves these EMF waves have negative effects on humans and IMO they are being used to control us in a certain way or to keep our brainwaves operating at a lower frequency so we ""conform"" more and ask questions and question reality less.  
  
This all started when I found [some research by the CIA](https://www.cia.gov/library/readingroom/docs/CIA-RDP96-00788R001700210004-8.pdf) that proved when you listen to certain sound frequencies that mimic your brain waves you can essentially ""force"" your brain into a certain state. There is research that says this is true and untrue but I believe it is true to a certain extent. Listening to it for a very short time probably won't effect much but I don't think any of the studies have done any long term effects on this. 
  
[It's proven that watching TV is equivalent to staring at a blank wall and it keeps you mostly in the Alpha waves which is related to falling asleep.](http://www.brainhealthandpuzzles.com/television_and_brain_function.html) Coincidentally , around the time that [TV became mainstream in American homes,](https://bebusinessed.com/history/history-of-the-television/) is the same time that [marijuana was made illegal](https://en.wikipedia.org/wiki/Legal_history_of_cannabis_in_the_United_States)  
  
So the first part of the theory is that EMF and other forms of waves do have an effect on how we act and think and can be used to keep us in a certain state.  
  
I've recently been reading a book that brought up a related point about ancient temples. [There are ancient temples that were built and literally mimic certain sound frequencies](https://phys.org/wire-news/164386603/ancient-man-used-super-acoustics-to-alter-consciousness-and-spe.html) which further proved my theory might be true. If this was known knowledge back then it has to be related.  
  
Now where marijuana comes in. I [Found a study where they looked at the brainwaves after people smoked marijuana.](https://www.vice.com/en_us/article/8gdy85/what-your-brain-looks-like-after-a-spliff-space-cookie-eeg-trajectory-876)  
> With Ana's two subjects, ""It was clear that the cerebral rhythm was faster after smoking and that wave amplitude was larger—which doesn't mean that things function chaotically, but that the **brain is in a higher alert state,""**  
  
>  You can see that the ""after"" trajectory is completely different from the first, as the changes appear on both a morphological wave level (bigger amplitude, typical aspect) and rhythm level (higher frequency, chaotic aspect).  
  
[Marijuana makes the brain ""nosier"".](https://www.psypost.org/2018/07/cannabis-users-exhibit-increased-brain-activity-rest-study-finds-51702) Which to me proves that it's the opposite effects of a TV and makes your mind more active which in theory would mean it's less likely to be ""controlled"". Which might explain why most users are more creative when they smoke. Which is most likely why try made it illegal right when television came out so less people would be able to ""resits"" the television waves. I can't see this being a random co-incidence and kinda proves why it's still a schedule 1 drug today. Most of the big pharma drugs make people tired and sedated which is why they want to keep those mainstream and not Marijuana based medicines.  
  
What do you guys think?  
  

More sources -  
  
Sound frequencies -   
https://www.cia.gov/library/readingroom/docs/CIA-RDP96-00788R001700270009-7.pdf  
  
https://www.cia.gov/library/readingroom/docs/CIA-RDP96-00788R001700210023-7.pdf  
  
https://www.cia.gov/library/readingroom/document/cia-rdp96-00788r001700210004-8  
  
[Brain Responses to a 6-Hz Binaural Beat: Effects on General Theta Rhythm and Frontal Midline Theta Activity](https://www.ncbi.nlm.nih.gov/pmc/articles/PMC5487409/)  
  
[Research has shown that when a person listens to binaural beats for a recommended time, their levels of arousal change.](https://www.medicalnewstoday.com/articles/320019.php#how-do-binaural-beats-work)  
  
https://hemi-sync.com/learn/research-papers/ - (this is the company that the CIA was working with in the documents above.)  
  
Ancient temples - 
[Mysterious Ancient Temples Resonate at the 'Holy Frequency'](https://interestingengineering.com/temples-resonates-frequency-111-hz)  
  
[Ancient Temple Architects May Have Been Chasing a Buzz From Sound Waves](http://www.viewzone.com/archeosound.html)  
  
[Vibrations and natural phenomena in ancient sites
affecting the brain activity](https://pdfs.semanticscholar.org/de8d/5ae52424d940f801578493c91fc67c1e7463.pdf)  
  
[The esoteric art of healing through sonic vibrations and beyond](https://www.meoko.net/news/the-esoteric-art-of-healing-through-sonic-vibrations-and-beyond)  
  
Other -  
[Earths frequency - Schumann resonances](https://en.wikipedia.org/wiki/Schumann_resonances)  
  
[Sounds from space](https://www.esa.int/Our_Activities/Space_Science/Sounds_from_space)",conspiracy,5G
62,The angst in your blood is that of your ancestors who took no bullshit from imperialist forces,324.0,fz5sy4,https://www.reddit.com/r/conspiracy/comments/fz5sy4/the_angst_in_your_blood_is_that_of_your_ancestors/,46.0,1586613535.0,"The feeling of fear is not for the virus but of a tyranny just waiting for the right moment to release the snare trap. The fight or flight is a natural reaction. Some bullshit is coming down on you and the people twirling the lock-down key chains are associated with those same type imperialist powers that our forefathers broke free from.

The powers are pharmaceutical giants and the paid-for ""politicians"". Just a fancy word for big pharma sales reps that appear on a ballot every November.

Yes, there may be one or two politicians that seem to be looking out for other things besides their corporate handlers, but it's just lip service or politics. 

The Colonies looked around and said waaaait a minute here, we're getting fleeced and made into tax slaves. They had to fight a metaphorical master or continue to live in chains for the benefit of a ruling class holed-up 3500 miles away in their castles. They might as well have been on Mars.

This ruling class now stands along side our elected president in a place called DC that also might as well be on Mars. A ruling class that is giving orders and direction without any discourse or reflection on the numbers they bark or real consideration for the actual human beings who are forced to listen to them every day. They could tell us there's a million cases or one hundred and we wouldn't know any difference or could even voice an opinion that would be heard. Hashtags are showing an alarming trend of near-empty hospitals. Renegade doctors are making videos pleading how the case reporting is pure fantasy and that the numbers are wildly inaccurate. And the Red Coats are at the podiums *denying* this reality, bald faced.

People are not as stupid as they seem. Sooner or later the bad movie will get old. The numbers reviewed in retrospect will show deep troughs in reported flu deaths, deep troughs in reported pneumonia deaths and deep troughs in reported heart attack or related fatalities. Put along side a super spiked curve of Covid19^TM related deaths, it'll be painfully obvious their numbers were cooked-up hysteria that destroyed a global economy and pushed hard for mass-vaccinations, sweeping DNA warehousing and 5G-tracked ""hall passes"" for those who get ""cleared"" by the Red Coats.

Maybe the jig was up for these ""Americans"" who rule over us from afar (DC). A despicable swamp of prostitutes with deep pockets and obscene pharma money packing them full, and it might be their last chance to click the cage door shut for good before you can run.",conspiracy,5G
63,Obama should probably return that Nobel Peace Prize. Dudes total body count of children in Yemen is actually criminal.,320.0,xf87ca,https://i.redd.it/47zcvvef93o91.jpg,56.0,1663276488.0,,conspiracy,5G
64,Hypocrisy: People are NOT ok with finding out that there are toxic heavy metals in baby popular foods but they are totally ok with the heavy toxic metals from the vaccines,320.0,ld6su9,https://www.reddit.com/r/conspiracy/comments/ld6su9/hypocrisy_people_are_not_ok_with_finding_out_that/,110.0,1612530600.0,"I mean just look [at this post](https://www.reddit.com/r/iamatotalpieceofshit/comments/lcno1u/of_course_nestl%C3%A9_and_walmart_are_involved/) from that sub.

What do you see? **25k upvotes**. **20+ awards**. **Thousands of outraged people**.

People seem to be aware that heavy toxic metals pose a threat to our health, HOWEVER, if those those heavy toxic metals enter your body through a different way(vaccines) then there's no problem at all. No biggie bro. That's totally fine and you're a dangerous 5g anti-vax nutjob Qanon conspiracy theorist for talking about the dangers of the toxic heavy metals from the vaccines.

Explain how their brain works.",conspiracy,5G
65,Anybody else notice people are just generally more hostile and dumber now days?,315.0,nmpjzu,https://www.reddit.com/r/conspiracy/comments/nmpjzu/anybody_else_notice_people_are_just_generally/,129.0,1622175533.0,"I live in a pretty anti vaccine/anti covid state, but working with the public I've just notice people in general just get hostile more quickly or completely lose common sense and with these interactions covid/vaccines/5G whatever was never the topic or anything like that, just genuine interactions about everyday things.


Or am I just going crazy idk man but shits getting wild, could it be the 5G radio waves, vaccines honestly I just don't know anymore these days I just want to live in the woods with an endless supply of ammo, have a weed plant, and brew some beers.",conspiracy,5G
66,"Former President Of Microsoft Canada, Frank Clegg: 5G Wireless IS NOT SAFE",305.0,ehuy1e,https://www.youtube.com/watch?v=DIV39-KOzh0&feature=share,96.0,1577752411.0,,conspiracy,5G
67,Undeniable proof shows that 5G towers don't cause any harm to the environment or to people.,294.0,gk5wnc,https://www.reddit.com/r/conspiracy/comments/gk5wnc/undeniable_proof_shows_that_5g_towers_dont_cause/,233.0,1589534696.0,"1. [5G has no effect upon birds](https://www.youtube.com/watch?v=UvK2ADrEZXw) 

2. [Bees don't mind the 5G towers either](https://www.youtube.com/watch?v=X5IhKHGDKhM&feature=emb_logo)

3. [5G towers don't cause any harm to nature](https://www.youtube.com/watch?v=hFEIxpCgEZM)

4. [These birds are simply loving the 5G waves, it calmed them down so much that they fell asleep](https://twitter.com/DeepStateExpose/status/1249059558032642050?s=20)

5. [5G towers improve people's health](https://www.dailymail.co.uk/health/article-6886561/Cell-phone-tower-shut-elementary-school-eight-kids-diagnosed-cancer.html)",conspiracy,5G
68,"Posted 3 or so months ago. Former President of Microsoft Canada says that 5G is not safe. Good to rehash this topic seeing as it will soon touch everyone's lives daily, presumably for the **rest** of our lives.",298.0,fw6juq,https://www.youtube.com/watch?v=DIV39-KOzh0,26.0,1586205582.0,,conspiracy,5G
69,The UK dropped all Mask and Vaccine Mandates!,295.0,s90k7f,https://www.reddit.com/r/conspiracy/comments/s90k7f/the_uk_dropped_all_mask_and_vaccine_mandates/,73.0,1642734726.0,"The mandates were lifted on Jan. 20.

It might be because Kazakhstan just OVERTHREW THEIR GOVERNMENT. Because the Government wouldn't allow them to get money from the bank unless they were vaccinated. They were arresting police and burning the houses of Politicians. It got messy. The leaders fled the country.

If I was Boris Johnson, I would do a quick 180 too!

Hopefully, this will encourage other dictators to stop forcing vaccines.

Unfortunately, a LOT of people could die from the vaccines (and shedding). Even more so when they turn on 5G. Which was scheduled to happen this week.

They say that the places where ""COVID"" started were the places to get 5G first. Like Wuhan and Italy.",conspiracy,5G
70,5G goes live tomorrow. Let’s hear your prediction,296.0,s7jqkz,https://www.reddit.com/r/conspiracy/comments/s7jqkz/5g_goes_live_tomorrow_lets_hear_your_prediction/,643.0,1642574111.0,,conspiracy,5G
71,FDA removes it's online claim that 5G Towers are safe after staff reveals the FDA NEVER EVER conducted any health or safety tests on 5G technology.,290.0,irg5sl,https://www.fda.gov/Radiation-EmittingProducts/RadiationEmittingProductsandProcedures/HomeBusinessandEntertainment/CellPhones/ucm116335.htm,38.0,1599929671.0,,conspiracy,5G
72,"Guys we're being played, as always.",278.0,ftgr0w,https://www.reddit.com/r/conspiracy/comments/ftgr0w/guys_were_being_played_as_always/,109.0,1585805876.0,"Honestly nobody knows wtf is really going on, and we probably never will. Not if we keep doing what we've been doing. As always, we're being played by the puppet masters behind the scenes. Using their high level influence in all aspects of our lives, they set forth a chain of events, and sit back and watch us destroy one another.

""The virus is a hoax, no the virus is worse than you know. No it's 5G, no it's an asteroid. They're taking our freedoms, no they just want to protect us."" I mean this list is endless. We're running around like chickens with our heads cut off.

Why? Because everyone is afraid, and divided. Just like you might look down with contempt at the ""sheeple"" wearing their masks and practicing ""social distancing"", they might look at you with contempt when you just want to be left alone and not buy into the lies.

I know it's cliche but really it's all about loving your fellow man in the end. A major crisis usually brings us closer together and it seems to be the only time we really care for one another but this one seems to be driving us even further apart. Deep down I know people are hurting. You can just see it. You can feel it.

Ever wonder why this sub is still around? People might tell you it's to big to be taken down or or whatever. I say they can take it down any time. It's just here to keep you distracted with all the noise. Because ultimately that's all this is in the end. Noise. Endless noise. You will never figure it out. That's the point. You have never gotten close to exposing them and you never will. They protect their own. People that get close to exposing truths are usually suicided.

People keep talking about Bill Gates, asking why he's so popular and pushing all this stuff. Bill Gates is just a mouth piece for ""them"". Just like Elon and Zuckerborg. They operate from the shadows so they need frontmen in order to remain behind the scenes.

This isn't meant to be a negative post. Just want to look at things from a realistic perspective. I don't know what the answers are. All I know is the one thing we can do right here right now is to try to be more compassionate and understanding toward one another, and to give less of our attention and energy to the system. It's what it runs on. Don't give them the one thing they can't forcibly take. Don't give them your humanity.",conspiracy,5G
73,Weird how we don't hear about asteroids or comet in MSM.,274.0,g1gvoh,https://www.reddit.com/r/conspiracy/comments/g1gvoh/weird_how_we_dont_hear_about_asteroids_or_comet/,175.0,1586908553.0,"Despite the fact that toxic comet tail could wipe us all;

Despite the fact that an asteroid is passing between the moon and the Earth tonight (0.36 Lunar Distance);

Despite the fact that one of the biggest asteroid in years is coming close to us on the 29th of April;

Despite the fact that 100+ telescopes got shutdown;

Despite the fact that US top officials are sealed in Cheyenne Mountain;

Despite all of this... We don't hear any news asking the real question.

This post will be followed by 100+ posts about Bill Gates, 5G and Trump within the next 10 hours. The ratio is now 100:1 for conspiracy concerning the sky. I mean! The fucking used a pandemic in 2001: A Space Odyssey to cover up what they (TPTB) discovered!


Weird how every medias' silent on this.

Oh, and fuck yeah, I want to be wrong. I love life and the Earth. 

But fuck! We are not being told 10% of the truth! It's all fake! *It's all a lie! It's all a life! It's all a lie!*

[*sauce*](https://themostbeautifulworld.com/blog/comet-atlas)",conspiracy,5G
74,"Since 5G conspiracies are being buried, and shills are downvoting any mention of 5G harmful effects, here's a link on info on the 5G Summit, starting tomorrow. Streamed videos of doctors and experts talking about the real potential harm of 5G",272.0,gu584j,https://the5gsummit.com/,220.0,1590953294.0,,conspiracy,5G
