,title,score,id,url,comms_num,created,body,subreddit,query
115,"Epstein was a CIA asset. The main players behind the worldwide child trafficking scandal are none other than the secret services - CIA, MI6, Mossad. Here is a collection of evidence.",2590.0,cp0amg,https://www.reddit.com/r/conspiracy/comments/cp0amg/epstein_was_a_cia_asset_the_main_players_behind/,207.0,1565547831.0,"Following the Epstein ""suicide"", it's more clear than ever that there is an organization which uses children in pedophilic sex parties, in order to blackmail and control powerful people. These children are frequently murdered by these sick individuals. Some can also be traumatized for the purpose of creating dissociative personalities so they can be mind-controlled. For a full breakdown of the worldwide scandals, see [this list](https://www.reddit.com/r/conspiracy/comments/689fwv/evidence_of_child_abuse_in_majorly_influential/) and [this documentary](https://www.youtube.com/watch?v=9274Q8jv_wM) - both of which are non-exhaustive and already out of date, such is the scale of this operation.

Common traits of these scandals are:

* Children kidnapped and used in sex parties for blackmail purposes
* Clear police involvement, by making errors in their investigations which let perpetrators go free, not following up on leads, etc.
* Police teams being changed, where one police team would be making progress on an investigation, then be dismissed and another police team being brought in which clearly has an agenda to discredit/ignore existing witnesses/evidence
* National or (more rarely) local media discrediting victim-witnesses, calling them liars, following a clear anti-victim agenda
* Judges giving harsh sentences to child witnesses and lenient sentences on perpetrators
* Witnesses and investigators being threatened and intimidated, vehicles malfunctioning, anonymous phone calls, etc
* Witnesses and investigators being murdered, or dying in suspicious circumstances (suicide despite no personal problems, or convenient ""accidents"")

Now ask yourself, what is the one type of organization which can accomplish all of these things? There is only one.

The **secret services**.

The only organization which would have the authority and the means to accomplish all these feats, to assert such a degree of control over all the outcomes, is military intelligence. Other entities may be involved - billionaires for example - but money can only accomplish so much. Yes you can purchase a newspaper and have journalists write something, but you can't just pay someone to murder someone in a prison and make it look like suicide. Prison security need to be moved, clearance needs to be given. People need to be so scared that they keep their mouth shut. The only way you do this is by having significant amounts of money and resources at your disposal, but also *authority* over them.

Here is a collection of evidence supporting this assertion:

1. Epstein flew a helicopter which shared tail numbers with a covert US military helicopter used by [DynCorp](https://en.wikipedia.org/wiki/DynCorp). Dyncorp has a history of child trafficking scandals in many countries and is owned by Steve Feinberg (US intelligence board). Epstein's pilot is rumored to be in US intelligence and a Mossad agent, Junkerman, has flown on his jet. [Summary](https://i.redd.it/y6u9zvu4e3f31.png). Epstein's close associate, [Ghislaine Maxwell](https://en.wikipedia.org/wiki/Ghislaine_Maxwell), is the child of media baron Robert Maxwell, who had links to British, Israeli, and Russian secret service.
Epstein got off very lightly in 2008 for sexually abusing underage girls. The current labor secretary, Alexander Acosta, gave him a very lenient deal. Who can pull the strings to make this happen? Either Acosta is a part of the conspiracy, or another entity was forcing his hand - the only entity that is capable of doing so is military intelligence.
AG William Barr worked in Epstein's legal team. Barr's father, Donald Barr, was in the OSS, which was the precursor to the CIA. Donald Barr gave Epstein his first job as a math teacher in an elite, politically connected school, even though Epstein did not have any qualifications or even a college degree.
And assuming that Epstein didn't commit suicide, whoever had him killed was able to make a murder look like suicide, inside a prison, while the target was under suicide watch. Guards were apparently told to leave the area due to maintenance, and CCTV camera footage was either prevented or confiscated [Source](https://twitter.com/BreakingNLive/status/1160235309596139520). Only military intelligence operatives have the resources to pull this off. Epstein's murder, whether real or faked, was the CIA disposing of a loose asset.

2. It is a documented historical fact that the CIA engaged in child trafficking, including child sexual abuse, to blackmail useful officials, in the [MK Ultra project](https://en.wikipedia.org/wiki/Project_MKUltra). [Source 1](https://www.newsweek.com/project-mkultra-documents-cia-brainwashing-techniques-black-vault-1073061) [Source 2](https://www.youtube.com/watch?v=Dn8XMlqcVcg). Note that only a small portion of the documents for this project ever came to light - the majority were destroyed.

3. The Franklin Scandal. The ring leader of the pedophile blackmail ring, Larry King, had ties to US Intelligence. [Source, page 34](http://the-eye.eu/public/Books//4chan_pol_Archives/PDFs/Miscellaneous%20Unsorted/pol/pol%20books%2014%20-%20nov%202016/The%20Franklin%20Scandal%20-%20Nick%20Bryant%20%282009%29.pdf) In a subsequent scandal involving a ""call-boy ring"" in Washington D.C., an associate of King's, Craig Spence, committed suicide in a hotel. The mysterious Spence was ""a CIA asset"" and had bugged his home so he could blackmail powerful people. [Source, page 279](http://the-eye.eu/public/Books//4chan_pol_Archives/PDFs/Miscellaneous%20Unsorted/pol/pol%20books%2014%20-%20nov%202016/The%20Franklin%20Scandal%20-%20Nick%20Bryant%20%282009%29.pdf)

4. Paul Bonacci, who was awarded $1m by a judge for the sexual abuse done to him by Larry King, was also involved in a MK-Ultra follow-up mind control operation called Monarch (also confirmed by other survivors). He directly named [Colonel Michael Aquino](https://en.wikipedia.org/wiki/Temple_of_Set#Foundation) as one of the leads in the project. Aquino worked for navy intelligence. Around this time, allegations of child sex abuse were being leveled at army bases all over the United States. [Source](http://humansarefree.com/2016/12/the-conspiracy-against-michael-aquino.html). So it seems, at least in the 70s and 80s, there was a dedicated program by the US military for child trafficking, sexual abuse, and mind control.

5. The Belgium Scandal. A key witness, Regina Louf, alleged that convicted child rapist and murderer Marc Dutroux kidnapped children, including her, for businessman Michel Nihoul. Louf alleged that Nihoul had hidden cameras and that she had to make sure her rapists were in the camera's field of view. Louf's allegations were independently corroborated by many other witnesses, many of whom could give intimate case details such as room layouts. Nihoul was found not guilty, after judges overruled the jury's guilty verdict. Louf was also discredited by the Belgian government's own TV station, which labelled her a deranged liar.
The case was the subject of a massive public outcry after police made a huge number of serious mistakes, such as even neglecting to search a basement after children's voices could be heard - this mistake led to the children starving to death in their basement cell. Many witnesses related to the case died in mysterious circumstances, such as committing suicide despite having no personal problems, or having car accidents.[Source 1](https://www.youtube.com/watch?v=djmm7GrgsUk) [Source 2](https://www.wanttoknow.info/mk/liftingtheveil#12)
Again, which organization has the ability to influence national media, influence senior judges, influence police, and kill people to make it look like suicide or an accident? The security services.

6. The Hampstead cover-up, in which two children related that their father forced them to engage in satanic ritual abuse at their school and at a church, as well as pedophilic parties with their father's friends, including cutting off babies' heads. Babies were supplied to the cult by social services. An experienced police detective is on record saying he believed the children and their mother. The authorities quickly closed ranks on the situation, with a judge removing the children from their mother, which goes against lawful procedure. Medical examinations by experienced professionals proved that the children had been sexually abused (vaginal and anal examinations). Crucial evidence was withheld from hearings. Child protection authorities and the Home Office was silent and inactive. 
To cover up information related to the case, all major media outlets were served with a defense advisory (DA) notice - *a DA notice is an official request to news editors not to publish or broadcast items on specified subjects which would compromise military or intelligence operations*. [Source](https://www.youtube.com/watch?v=fWwoe2eB-Bo).

7. In 1987 a satanic cult in Washington D.C., the Finders, was investigated after children were seen being apparently trafficked by two well-dressed men. At the properties of the Finders, investigators discovered evidence of satanic ritual abuse, blackmail, sophisticated communication technology, and explosives. The CIA took over the investigation and declared it an ""internal matter"". No further investigation was permitted. [Source](https://youtu.be/33cijzHhPow?t=2241)

8. Ronald Bernard confesses in an emotional interview about having to sacrifice children to prove yourself as a psychopath in the financial elite. He also says that ""secret services are actually criminal organizations ... they will stop at nothing. They have their flows of money from trading drugs, weapons, people. All that money has to come from somewhere, everything has to be financed."" [Source](https://youtu.be/xC62iJ_oXDE?t=1101)

9. The Jersey scandal (full breakdown [here](https://www.reddit.com/r/conspiracy/comments/aq8935/we_need_to_talk_about_the_island_of_jersey/)). A policeman, Lenny Harper, investigating a children's care home (which Jimmy Savile frequently visited), claims he recovered forensic evidence that children were killed and incinerated in the basement. In March 2008, BBC television personality Jimmy Savile started legal proceedings against The Sun newspaper which had, wrongly he claimed, linked him in several articles to the child abuse scandal at Haut de la Garenne. Savile initially denied visiting Haut de la Garenne, but later admitted that he had done so, following the publication of a photograph showing him at the home surrounded by children. The States of Jersey Police said that in 2008 an allegation of an indecent assault by Savile at the home in the 1970s had been investigated, but there had been insufficient evidence to proceed.
The forensic evidence found on the site was repeatedly compromised when it was sent to the UK for analysis. Lenny Harper received many death threats and was attacked by Jersey's local media, and some national media outlets. A journalist who later tried to investigate was arrested, held for 12 hours at Heathrow airport, and banned from the island. [Vice article](https://www.vice.com/en_us/article/xd4954/the-journalist-who-was-banned-from-investigating-jerseys-child-abuse)
The list of suspects in the case include British government officials. According to Harper, Chief Minister for Jersey Frank Walker (OBE) warned Harper that his investigation could ""bring the government down"".
In September 2008, the investigation team was changed. David Warcup, the leader of the new team, said there was ""no evidence"" that children were killed at Haut and that Harper's information he gave to the press were not accurate. Warcup said that the bones were animal bones and that the 60 milk teeth had come out naturally. [Telegraph article 2](https://www.telegraph.co.uk/news/uknews/3446619/Jersey-police-chief-suspended-as-claims-of-child-murders-ripped-up.html) The new team also claimed that a child's skull was actually a piece of coconut (citing no scientific analysis), going against statements made by two anthropologists that it was a skull fragment as it contained collagen, and moreover that it was ""fleshed and fresh"" when it had been burned. [Source](https://www.telegraph.co.uk/news/uknews/3446619/Jersey-police-chief-suspended-as-claims-of-child-murders-ripped-up.html) Warcup said that the bones which were found could have been hundreds of years old, however an expert told Harper that they could only be a few decades old. [Source 2](https://www.belfasttelegraph.co.uk/news/jersey-probe-lenny-harper-hits-back-28454432.html)
MP John Hemming said that he had no doubt that there were efforts to cover up the murder evidence. [BBC article](http://news.bbc.co.uk/2/hi/uk_news/7534350.stm)

10. A man called Carl Beech claimed that in the 70s and 80s he and a number of other boys were raped by powerful people in London. He made claims specifically against twelve people, including the former Members of Parliament Harvey Proctor (who had already been convicted of gross indecency for having sex with teenage boys) and Greville Janner, the former Home Secretary Leon Brittan, the former Prime Minister Edward Heath, the former Chief of the Defence Staff Lord Bramall, the former Director of the Secret Intelligence Service Maurice Oldfield, and the former Director-General of MI5 Michael Hanley. Beech claimed that he was abused at a number of places including Dolphin Square, the Carlton Club, and various other places in the Home Counties. Beech also falsely claimed that the group murdered three children: two for sexual pleasure, and a third to intimidate the others. Proctor's solicitors told him that Beech had alleged that he had seen Proctor repeatedly stab a 12-year-old boy before strangling him to death, and that he himself had been raped by Proctor.
The officer leading the investigation, Detective Superintendent Kenny McDonald, said in December 2014 that experienced officers had concluded that the allegations were ""credible and true"". McDonald was later criticised for the statement, and it was retracted. The investigating team was changed, no further evidence was found, and Beech was sentenced to 19 years in prison. [Source](https://en.wikipedia.org/wiki/Operation_Midland)

11. Natacha Jaitt, a playboy model, alleged that she had evidence of a VIP child abuse ring, involving journalists and politicians in Argentina. She tweeted that ""Notice: I will not commit suicide. I won’t be bought off or drown in a bath tub, nor will I shoot myself in the head. So, if that happens: I wasn’t me. Save this tweet."" She was later found dead of an apparent drug overdose - her lawyer and brother suspect foul play. [Source](https://metro.co.uk/2019/02/26/model-tried-expose-paedophile-ring-found-dead-8744960/)

12. Former police officer Mark Minnie wrote an explosive book detailing a pedophile ring in South African government. Minnie, 58, was found with a bullet to his head, but many people are refusing to believe the police version - that he took his own life at the farm of a friend near the coastal city of Port Elizabeth.
""The fact that the suicide note was found doesn't necessarily mean he wrote it willingly. I mean he could've written it under duress. The fact that he shot himself with someone else's pistol already raises questions,"" investigative journalist and author Jacques Pauw told South Africa's radio 702. [Source](https://www.bbc.com/news/world-africa-45195756)

13. Imane Fadil was a Moroccan ex-model who became a celebrity after becoming a key witness in the 2013 “Rubygate” trials which accused the media mogul and ex-Prime Minister of Italy Silvio Berlusconi of “child prostitution”. Fadil was also looking to be a witness in a related investigation (dubbed “Ruby ter”) that is still ongoing.
In 2018, Fadil claimed in an interview that Berlusconi’s infamous “parties” lead to dark, satanic rituals. She was also in the process of writing a tell-all book about Rubygate and the dark secrets of Berlusconi. The name of the projected book was quite evocative: I Met the Devil.
However, in the past weeks, things dramatic turn. Imane Fadil died in a hospital room in Milan on March 1st after a month of agony. Media sources reported her death only 15 days after the fact, mostly because authorities announced the opening of a homicide investigation. Indeed, the cause of Fadil’s death is currently believed to be “murder by radioactive poisoning”. [Source](https://vigilantcitizen.com/latestnews/the-ex-model-who-claimed-silvio-berlusconi-hosted-satanic-rituals-in-his-house-died-from-apparent-poisoning/)",conspiracy,Epstein
116,Epstein Had Painting Which Appears to Be Bill Clinton in a Dress and Wearing Red Heels,2582.0,cqef75,https://i.redd.it/cndi1qz6sgg31.jpg,321.0,1565810263.0,,conspiracy,Epstein
117,Federal judge says government covered up plea deal with Epstein,2472.0,ath60t,https://www.newsweek.com/jeffrey-epstein-alexander-acosta-trump-sex-trafficking-underage-minor-1339974,490.0,1550839483.0,,conspiracy,Epstein
118,Bill Gates ignores questions on Reddit about his friend Jeffery Epstein,2456.0,10adem0,https://i.redd.it/ookyci8myoba1.jpg,338.0,1673563790.0,,conspiracy,Epstein
119,"Despite being a college drop-out, Epstein was hired in 1973 by Donald Barr, an ESPIONAGE AGENT and headmaster at Manhattan’s private Dalton School (1964–74), as a calculus and physics teacher. There Epstein taught from 1974 to 1976.",2456.0,dc9bm8,https://www.reddit.com/r/conspiracy/comments/dc9bm8/despite_being_a_college_dropout_epstein_was_hired/,172.0,1570018303.0,"During World War II, Donald Barr worked for the OSS (forerunner of the CIA). He is also the father of the current United States Attorney General William Barr, who is currently overseeing Epstein’s prosecution. The hire was unusual for a number of reasons: Epstein had not earned a college degree, the other odd circumstance was that he was only 20 years of age.

https://www.youtube.com/watch?v=-Q9UdcizUL4

https://hillreporter.com/the-ties-that-bind-jeffrey-epstein-william-barr-donald-trump-34107

https://www.nytimes.com/2019/07/12/nyregion/jeffrey-epstein-dalton-teacher.html

https://lawandcrime.com/high-profile/the-epstein-barr-problem-of-new-york-citys-dalton-school

http://accuracy.org/release/epstein-protected-because-he-is-a-spy-a-backgrounder

https://www.miamiherald.com/news/politics-government/article228148659.html",conspiracy,Epstein
120,"The Sister of Epstein's ""Madame"" Ghislaine Maxwell, Is""technology pioneer"" of the World Economic Forum. You cannot make this shit up.",2440.0,rv5ekn,https://i.redd.it/nis8xsnh0i981.jpg,235.0,1641226834.0,,conspiracy,Epstein
121,The CEO of Apollo will step down after an inquiry found he paid $150 million to Jeffrey Epstein. The sum effectively bankrolled the disgraced financier’s lifestyle after his 2008 guilty plea to a Florida prostitution charge involving a teenage girl.,2411.0,l50o95,https://www.nytimes.com/2021/01/25/business/leon-black-apollo-jeffrey-epstein.html#click=https://t.co/7fdh50CBy7,148.0,1611617572.0,,conspiracy,Epstein
122,Theory: The Simpsons seem to have predicted many world events because Matt Groening was part of the occult elite,2414.0,ctzwup,https://www.reddit.com/r/conspiracy/comments/ctzwup/theory_the_simpsons_seem_to_have_predicted_many/,382.0,1566491738.0,"Since the Simpsons creator Matt Groening has been implicated with with Epstein, it seems reasonable to believe that he has been in direct contact with the occult elite who have a direct impact on world events.",conspiracy,Epstein
123,Why was Epstein (A practising jew) having a private meeting with the pope and receiving his blessings ?,2401.0,wdemxh,https://i.redd.it/0xskgqzd33f91.jpg,537.0,1659351823.0,,conspiracy,Epstein
124,Did Trumps attorney Lin Wood just hint that Epstein is alive and they have him?,2376.0,kde7xo,https://imgur.com/a5J5qBL.jpg,784.0,1608004585.0,,conspiracy,Epstein
125,We need to track down every person who donated even a single dollar to the truckers’ protest! But also let’s not bother figuring out who was soliciting sex with minors from Ghislaine and Epstein.,2336.0,svfc11,https://www.reddit.com/r/conspiracy/comments/svfc11/we_need_to_track_down_every_person_who_donated/,91.0,1645182195.0,,conspiracy,Epstein
126,"Victim claims she was raped by Jeffrey Epstein and Ghislaine Maxwell at Les Wexner's house, and Maxwell threatened to kill her if she spoke about it.",2307.0,dvslim,https://www.dailymail.co.uk/news/article-7678315/Woman-spoke-Epsteins-bail-hearing-sues-estate.html,204.0,1573655675.0,,conspiracy,Epstein
127,Seems Wikipedia has altered Epstein’s bio already. First screenshot of Epstein’s bio was at 8:27 a.m. The 2nd was at 10:30 a.m. omitting Bill Clinton,2304.0,catmno,https://imgur.com/1Oq9ymP.jpg,261.0,1562633451.0,,conspiracy,Epstein
128,You know Jeffery Epstein and the Clinton’s are connected. But did you know he just got a sweetheart deal for sex trafficking a 14 year old victim with Dershowitz as his attorney and the DA that made the deal is now Trump’s Labor Secretary? The sickness knows no political boundaries.,2304.0,a4mdpv,https://www.miamiherald.com/news/local/article220097825.html,212.0,1544374486.0,,conspiracy,Epstein
