,title,score,id,url,comms_num,created,body,subreddit,query
0,Sources: Jeffrey Epstein dies by suicide in Manhattan jail cell,35627.0,cohqc7,https://www.google.com/amp/s/abc7news.com/amp/sources-jeffrey-epstein-dies-by-suicide-in-manhattan-jail/5457853/,5314.0,1565442004.0,,conspiracy,Epstein
1,Don’t Let This Die. Shes A Confirmed Child Sex Trafficker. She Was As Involved As Epstein Himself. She Ruined The Lives Of Children By Selling Them Into Sex Work To Blackmail High-Level Politicians & Aristocrats. Why Is She Not Under Arrest?! No Investigation? She Holds The Key To Epstein’s Secrets,33253.0,dr328e,https://i.redd.it/ev6fwaoqtgw31.png,876.0,1572799850.0,,conspiracy,Epstein
2,HAPPENING: Epstein Fed-Ex Assassin AND Epstein private banker both commit SUICIDE. Both IN ADDITION to Judge/Judges son previously.,31119.0,huwux1,https://i.redd.it/3ntf1fi7p3c51.png,1664.0,1595289539.0,,conspiracy,Epstein
3,"Ghislane Maxwell, long-time friend and confidante of Jeffrey Epstein, has been arrested by the FBI and charged by federal prosecutors",23319.0,hjwwdt,https://www.nbcnewyork.com/news/local/crime-and-courts/ghislaine-maxwell-arrested-jeffrey-epstein-aide/2495762/?cid=ed_npd_bn_tw_bn&amp&__twitter_impression=true,2245.0,1593696118.0,,conspiracy,Epstein
4,Gunman kills son of federal judge Esther Salas at their home. The Jeffrey Epstein Deutsche Bank case was assigned to Judge Salas just two days ago.,22732.0,hudjgs,https://www.nydailynews.com/news/national/ny-judge-esther-salass-son-killed-after-home-invasion-20200720-23zv6vvoxndrhjeiuf4xfnmwji-story.html,1646.0,1595213377.0,,conspiracy,Epstein
5,Don’t Let This Die. Shes A Confirmed Child Sex Trafficker. She Was As Involved As Epstein Himself. She Ruined The Lives Of Children By Profiting Off Of The Sale Of Them To Blackmail High-Level Disgusting Politicians & Aristocrats. Why Is She Not Under Arrest?! Arrest Her Now!,22196.0,d214oe,https://i.redd.it/aot1ekrpvjl31.jpg,772.0,1568081448.0,,conspiracy,Epstein
6,"Judge demands answers from Jeffrey Epstein’s estate after millions of dollars flood into his dormant offshore bank in the Virgin Islands, and then ""disappear"". This adds weight to the supposition that Epstein is alive, and in hiding.",17864.0,ezawg1,https://www.dailymail.co.uk/news/article-7969451/Epsteins-mystery-bank-came-alive-death.html,772.0,1580915366.0,,conspiracy,Epstein
7,"Newly leaked photo of Chauntae Davies, a Jeffrey Epstein victim, giving a back message to Bill Clinton. (2002)",17505.0,ic5vyi,https://i.redd.it/6thzztyvtsh51.jpg,1441.0,1597772984.0,,conspiracy,Epstein
8,"Newly released photos show Maxwell and Epstein relaxing at a cabin thought to be the porch of the Queen's log cabin. Is it possible this all goes way, way deeper and worse than we thought?",17158.0,rc13h3,https://i.redd.it/okfldphnwd481.jpg,1949.0,1638997876.0,,conspiracy,Epstein
