,title,score,id,url,comms_num,created,body,subreddit,query
197,Marc Dutroux,1450.0,hrfjsy,https://www.reddit.com/r/conspiracy/comments/hrfjsy/marc_dutroux/,296.0,1594781054.0,"The story I'm about to tell you is true.

Perhaps the most intriguing part of this story is that every single person reading this post - every single one of you - was alive when this story became news in 2004.

That fact is intriguing because everyone reading this post has either never heard this story, or forgot about it (I'm betting on the first one, because it is truly unforgettable).

Furthermore, once you hear this story in its entirety, I can promise it will be seared into your memory forever.

Our main character is a man named Marc Dutroux. He was born in Belgium in 1956. He was twice convicted of kidnapping and raping underage children. The first time was in 1989. The second time occurred in 1996.

That was not a typo - you read that correctly. He was convicted and served a (much too brief) sentence in 1998. He served only 3 and a half years of his 13 year sentence because he was released for good behavior. Less than 10 years later, he was arrested again on the same charges (different victims).

In the second round of charges, he was convicted of kidnapping, torturing and abusing victims, some of them to the point of death.

What I am about to tell you comes from the statements made by his surviving victims (called the X Files), Marc Dutreox himself, and evidence from law enforcement. I've also added references/citations at the very end of this post.

Here we go.

Marc confessed to kidnapping, raping, drugging, torturing and filming children for many years. He also claimed he was doing it at the behest of a political elite who financed his career as a professional trafficker.

Not only did this political elite finance his efforts - they made specific requests of him. Sometimes they requested specific types of children (they were called ""party favors"" and he was asked to deliver kids of certain age, sex, race). Sometimes they requested specific means of torturing the children to fulfill their desires (orgies, satanic rituals involving sacrifices, torture games).

And sometimes they requested he film certain influential people engaged in these acts, for later use as blackmail.

He claimed many of his customers and financiers were world leaders. This was not a stretch of the imagination because he lived in Belgium, where the EU and NATO headquarters were located. This statement was also corroborated by victims who were able to identify specific politicians.

Anneke Lucas was one of his victims who testified against him. She claimed she was 6 years old when the cleaning lady hired by her mother sold her to the pedophile network in 1969. Her claims were extraordinary:

-She was raped over seventeen hundred hours before turning 12 years old.
-She was 6 years old when she was forced to participate in her first orgy, which included wearing an iron dog collar and eating human excrement.
-She would actually be delivered back to her parents from time to time. However, her parents themselves were complicit in the crimes and always sent her back to her abusers.
-Torture included being strapped to a butchers block used to execute other children. Other victims were forced to torture her for hours as part of their initiation.
-She was considered attractive and that made her preferred by her abusers. She claimed that she tried to use that to her survival advantage to the best of her ability, but by the age of eleven, she had become so broken that she was slated to be executed and disposed of.
-She said she was saved when one of her abusers negotiated for her freedom. That abuser would later sit as a defendant in the trial.

Other witnesses and victims would soon come forward, describing such things as “Black Masses,” with child and adult sacrifices taking place in front of observers and participants, which included prominent politicians and figures. This would be corroborated by a note found by police at the house belonging to Bernard Weinstein—a man who previously worked with Dutroux, but whom Dutroux had murdered. The letter contained very specific requests for certain types of victims for satanic sacrifices.

The letter was signed by a man who called himself 'Anubis'. It turned out 'Anubis' was the high priest of a satanic cult called 'Abrasax' whose real name was Francis Desmet. Police obtained a warrant and seized computers, documents, mail, actual human skulls, jars of blood, and all sorts of Satanic items - but none of this was enough to make an arrest.

As the Dutroux trial went public, other victims stepped forward and confirmed the testimony, offering up descriptions of sexual abuse and human sacrifice.

They also described “hunting parties” where elites would release naked children into the woods to hide, so that the elites themselves could hunt them down and slaughter them. Many of the stories from victims contained so many similarities, they were impossible to deny. For example, the hunting parties were often held at castles, where victims could not escape and were hidden from the public eye. Those not killed in the hunt were usually chased down and mauled/killed by Dobermans.

All of these victims echoed the testimonies of other, older survivors of ritual Satanic abuse from around the world.

It is also notable that Dutroux owned 10 homes valued at 6 million dollars.

It is also notable that Dutroux was not employed.

It is also notable that Dutroux received $1,200 per month in public assistance.

It is also notable that documents released by Wikileaks show large sums of money in various currencies were deposited into his wife's bank account.

It is also notable that those deposits coincided with reported kidnappings and missing children reports.

It is also notable that before his removal, judge Jean-Marc Connerotte was on the verge of publicly disclosing the names of high level government officials who had been recognized on video-tapes of sexual torture that took place in Dutroux's dungeon.

It is also notable that 20 potential witnesses for this case have died without explanation.

Does any of this sound familiar?
Are there any headlines today that sound like history is repeating itself?

Guys, not one single thing in this post is theory. It's all proven and on record.

You see the pictures attached to this post? Those are images of hunting games. They're paintings that people like Tony Podesta buy, and hang in his home, and invite others over to enjoy.

We all know Epstein was a sick sob who had friends in high places - the same friends that hang out with Tony Podesta.

You think Epstein was the only one? That he's somehow unique? Or was he the low level one they were willing to sacrifice to protect everyone else involved at a higher level?

Do you realize now that when it comes to trafficking, satanism, pedophilia, human sacrifices, organ harvesting, adrenachrome - that it is art imitating life? That these people who are so obsessed with the art that glorifes these things might actually, themselves, be engaged in these things?

Do you think normal, non-pedo, non-cannibal, average Joes would hang that garbage up in their homes?

Suddenly the claims that world leaders and governments being involved in this satanic horror show isn't so far fetched after all.

Suddenly its not so crazy to say that world agencies who claim to stop these crimes (WHO, UN) are actually facades that cover up the real work of procuring and enabling - yes, even participating - in these crimes.

Suddenly the whole house of cards comes crashing down.

With this one case, all the unbelievers are silenced.

For crying out loud, this trial was in 2004! Did you remember it? If not, do you wonder why it was not front page news across the world?

And if you're asking yourself HOW DO THESE PEOPLE GET AWAY WITH THIS - have you not yet figured out that the very people who are supposed to end it, are doing it?

Most everyone has watched an Epstein documentary on Netflix - I think there's been maybe 3 or 4 made since his death. And the one thing I heard people say over and over and over again was this: ""Where is Epstein's girlfriend and why hasn't she been arrested yet?""

Did anyone asking that question even try to find the answer? Or did you just shrug your shoulders and say, ""Well, it is what it is and there's nothing I can do about it"" and go on with your life?

Let me help you out.

Did you hear the news story from two weeks ago that President Trump fired federal prosecutor Geoffrey Berman? He was the prosecutor in charge of the Epstein case.

AG Barr requested Berman step down, and Berman refused. So Trump fired him and Berman was replaced with prosecutor Audrey Strauss. And then suddenly BAM! Maxwell is in custody.

You now get a front row seat for the horror show that is about to come out.

You will not believe who is involved and how deep it goes. And you will not believe the lengths they'll go to in order to protect their secrets. 

[https://cwasu.org/wp-content/uploads/2016/07/Confronting-An-Atrocity.pdf?fbclid=IwAR1iFppDKV9fKTovmv9zLfWBQduNSavsSNA4_4fuavxF6Y5u0n8tB7JfI60](https://cwasu.org/wp-content/uploads/2016/07/Confronting-An-Atrocity.pdf?fbclid=IwAR1iFppDKV9fKTovmv9zLfWBQduNSavsSNA4_4fuavxF6Y5u0n8tB7JfI60)

[http://archive.is/SFRGD](http://archive.is/SFRGD)

[http://archive.is/jxiLV#selection-3715.53-3715.70](http://archive.is/jxiLV#selection-3715.53-3715.70)

[https://www.euronews.com/amp/2019/10/27/explainer-paedophile-marc-dutroux-and-the-horror-case-that-united-a-divided-belgium](https://www.euronews.com/amp/2019/10/27/explainer-paedophile-marc-dutroux-and-the-horror-case-that-united-a-divided-belgium)

[Podesta like paintings ](https://imgur.com/a/MlVVWPI)

Edit: I am not the OP. I found is somewhere else on the internet and thought you guys would enjoy it. I’m pretty surprised I haven’t heard of it myself.

Edit: [Anneke Lucas testimony ](https://youtu.be/zQFOrwyFopA)  This is a pretty valuable testimony from the former child who helped expose Dutroux.",conspiracy,Epstein
198,Why is Tucker Carlson the only one in the MSM actively investigating Jeffrey Epstein?,1456.0,edau1c,https://www.youtube.com/watch?v=2UF2ibhDkPc,275.0,1576851836.0,,conspiracy,Epstein
199,I Am a Democrat. My Eyes Are Now Open.,1437.0,s94ny9,https://www.reddit.com/r/conspiracy/comments/s94ny9/i_am_a_democrat_my_eyes_are_now_open/,581.0,1642747855.0,"I want to start by saying that I am a college student in Los Angeles, registered Democrat; supported Bernie 2016, voted Biden 2020.

I have browsed this sub for a long time, but admittedly got caught up in the circus (mass psychosis) of the last couple years of political, social, civil, public health, and economic chaos. I have always had an intuitive feeling that Biden was ushered in as President by the powers that be, but went along with it because I felt that Trump was also chosen by the elite. Trump played a very important role, and now it was Biden’s turn (whether Trump was ready to go or not).

I thought, hell, might as well go along with it. Frankly, Biden’s promise of playing nice and ending COVID sounded comforting. What could he possibly do that would be so terrible? He would just remain a boring, white bread, moderately left President and not accomplish nor destroy anything significant.

Well, after yesterday’s press conference, my eyes have been completely opened. **Biden is here to oversee the fall of America as we know it.** He is here to oversee the great reset, the great awakening, whatever you want to call it. Dark times are ahead, and the powers that be have installed a puppet to mislead us, following the installation of a clown to distract us from 2016-2020.

I strongly believe that the next coming years will see great global economic, diplomatic, and societal fallout.

This includes: the worst economic crash of all time, stock market manipulation exposed, the inevitable rug pull of COVID, the public realizing that the last 2 years of their lives have been stolen from them for financial/political gain, Russia and China disturbing global sovereignty, Metaverses, cryptocurrency, and possibly much more. The economic crash will be so severe that it will be used to convince people that a great reset is NEEDED, just like 2 years of quarantines, masks, and vax were needed to stop the pandemic.

I also believe that we will continue to see the rapid cognitive decline of President Biden. I mean, I voted for the man, but yesterday’s press conference was *the single most embarrassing event I’ve ever witnessed* from the White House press floor. He was confused, delusional, misleading, out of touch, and by the end of it, there were numerous times where he was literally incoherent, unable to remember what he was saying as he was saying it.

This may or may not lead to the invocation of the 25th amendment. I’m not sure if TPTB will milk a full 4 years out of Biden or not, given Kamala’s inability to do apparently anything correct. The MSM is already turning on them both, so I’m not sure what this suggests for the impending chaos awaiting us in the next 3 years.

I have never experienced such a 180 degree revelation of my own cognitive dissonance and misinformed biases before. I feel shame, embarrassment, and anger for being conned into voting for these people. I truly believe that Biden & Harris are in place to oversee the darkest times in American history, and to divide this country further than it already is - in a completely different method than Trump’s rhetoric did.

My eyes are now open. I am now looking back at the 2020 election, the exploitation of the pandemic leading up to it, the media circus of narratives (COVID death tolls, Antifa, BLM, Proud Boys, George Floyd, Kyle Rittenhouse, presidential debates, election fraud, Jan 6th) and I see everything in a whole new perspective now. Even popular online conspiracy theory discourse all seem like orchestrated misinformation campaigns to me: Epstein, flight logs, Maxwell, Trump & Epstein, Biden sniffing kids, QAnon, Clintons, Plandemic, Bill Gates.

It's all fucking manipulated chaos and hysteria. We are living in an orchestrated sociopolitical theater, a clown circus, an amalgam of constant psyops and new world agendas. 

Why? I have absolutely no answer nor explanation. But I am seeing things that I have never seen before and I hoped to confide in this sub to share my truths.

TL;DR: We're fucked, man.",conspiracy,Epstein
200,Jeffery Epstein is dead,1428.0,cohq07,https://twitter.com/juliamacfarlane/status/1160172238475337728?s=19,375.0,1565441957.0,,conspiracy,Epstein
201,Epstein didn't kill himself,1429.0,mc4fd9,https://i.redd.it/hajkm1w2zyo61.jpg,137.0,1616588841.0,,conspiracy,Epstein
202,Zach Braff tweets “he killed himself-gif” Jeffery Epstein,1418.0,cokei3,https://i.redd.it/skr1n73qhnf31.jpg,79.0,1565455603.0,,conspiracy,Epstein
203,Why isn’t EVERYONE demanding Epstein & Maxwell’s client list be published?,1409.0,wq32un,https://www.reddit.com/r/conspiracy/comments/wq32un/why_isnt_everyone_demanding_epstein_maxwells/,239.0,1660677781.0,"This is honestly an opportunity for the right, and the left, to go hand-in-hand and demand justice. So why aren’t we doing it?

I don’t give a single fuck if the people I support or voted for  gets locked up because they are on the client list. You shouldn’t care if the people you voted for or support are incriminated either. 

This could honestly wipe out the whole corrupted system, and start with a clean slate. Politicians, judges, celebrities, Hollywood. 

Why isn’t everyone in unity for this?",conspiracy,Epstein
204,Remember when Reddit banned r/pizzagate,1404.0,crmb9d,https://www.reddit.com/r/conspiracy/comments/crmb9d/remember_when_reddit_banned_rpizzagate/,440.0,1566049523.0,Epstein is not a new name to many. Reddit protected him by banning pizzagate subs.,conspiracy,Epstein
205,So now we know the media had deep knowledge on Epstein for 3 years. At the same time they spent *massive* resources telling people that pizzagate had no basis in reality. #epsteincoverup,1394.0,ds5h7z,https://www.reddit.com/r/conspiracy/comments/ds5h7z/so_now_we_know_the_media_had_deep_knowledge_on/,239.0,1572987608.0,This is reaching peak levels of absurdity. Truly a clown world,conspiracy,Epstein
206,This is Jeffrey Epstein's Ex Pilot Larry Visoski. He flew the 'Lolita Express' and testified at the trial of Ghislaine Maxwell that he flew VIPs to luxury locations worldwide,1389.0,ycawq5,https://i.redd.it/g6dt8f696rv91.jpg,111.0,1666617134.0,,conspiracy,Epstein
207,This shit is older than Epstein,1380.0,hti84h,https://i.redd.it/14ym7rp9umb51.jpg,160.0,1595085382.0,,conspiracy,Epstein
208,"Jeffrey Epstein bought his NM ranch under a trust named the Zorro Trust. When Epstein pleaded guilty on 6/30/08, 2 days later, someone won an $85 million Powerball jackpot. The winner? The Zorro Trust",1367.0,r2ua4x,https://bismarcktribune.com/news/state-and-regional/trust-claims-lottery-ticket-worth-85m/article_c668d806-f66e-5abb-ab0b-a013fbeaee3f.html,123.0,1637953264.0,,conspiracy,Epstein
209,"Audience member to Bill Gates, ""Why did you fly on Epstein's Lolita Express 26 times?""",1360.0,nk2h5p,https://files.catbox.moe/yvr7t8.mp4,223.0,1621875046.0,,conspiracy,Epstein
210,4chan user explain Esptein's cause of death nearly an hour before it hits mainstream media. Another alleges suspicious van may have taken Epstein and replaced him with a double.,1358.0,corg5o,https://i.redd.it/g8q8bkpjgqf31.png,143.0,1565491777.0,,conspiracy,Epstein
211,"Why is Bill Gates never questioned about his relationship with Epstein? Does anyone find it odd how often Bill Gates is on the news like CNN and not once does anyone ask ""What was your relationship with Epstein and what did you two discuss?""",1354.0,idljn4,https://i.redd.it/5z3ucc5ft7i51.jpg,140.0,1597966444.0,,conspiracy,Epstein
212,Clinton Coup vs. Counter-Coup,1357.0,5arlen,https://www.reddit.com/r/conspiracy/comments/5arlen/clinton_coup_vs_countercoup/,417.0,1478111093.0,"On November 1st, [Steve Pieczenik](https://en.wikipedia.org/wiki/Steve_Pieczenik) released [this video](https://www.youtube.com/watch?v=ov5kvWSz5LM) which is well on its way to a million views.

Pieczenik claims that the Clintons are attempting a coup by using corruption and political cronyism to infiltrate and influence the White House, CIA, FBI and Attorney General.

He goes on to state that a counter-coup has been initiated by members of the ""intelligence community"" from over a dozen agencies with the help of Wikileaks. When Comey brought the Weiner emails to light, this was:

>the entrée in the counter-coup to say to the administration: ""we have your number."" Not only do we have your number, we're going to stop you from making Hillary the next POTUS, and at the same time we're going to convict and indict the POTUS, Loretta Lynch and many others who were involved in the massive coverup that occurred under the Clinton Foundation.

He goes on to state that this may be the first time both a coup and counter-coup was initiated via the internet. He stresses the need for a peaceful transition and that indeed this is a very important historical moment.

[A second video](https://www.youtube.com/watch?v=12zVlaZyX3Q) was uploaded by Pieczenik on the same day, this time detailing the Clinton's ties to Jeff Epstein and the global pedophilia network. 

He continues by stating that there's much more to the Weiner emails story, and that the NYPD has information about Hillary Clinton and many of the elites and their predilection for pedophilia. 

For more information on the topic, see this original research that was shared with /r/conspiracy years ago:

[The Mountain of Evidence for a Massive International Pedophile Ring Protected by Police and Intelligence Agencies](https://www.reddit.com/r/conspiracy/comments/1cm0t3/original_research_the_mountain_of_evidence_for_a/)

And finally, from [this thread](https://www.reddit.com/r/conspiracy/comments/5anw92/much_bigger_than_the_presidential_race_major/):

>[Stay current on FBI leaks](https://twitter.com/FBIRecordsVault/with_replies). There is something on paper and they want us to find it through FOIA requests as they cannot be the ones to initiate the interruption of the election.

>Someone in the FBI activated a twitter account that the FBI created to release records which hasn't been used since its creation. Suddenly, it's blowing up with leaks a year later.

>Search hard and search fast ladies and gentlemen. This may be the most important and busy ""battle"" of the war.",conspiracy,Epstein
213,"A reminder that Barbara Walters was in Epstein's black book list. She also had a life long career in ABC News. The same ABC that shut down an interview with the victim Virginia Roberts Giuffre, who was trying to expose Epstein, Clinton, and Prince Andrew.",1348.0,zzkxoq,https://i.redd.it/cabgjh3hq59a1.png,113.0,1672459672.0,,conspiracy,Epstein
214,Ghislaine Maxwell Gives Jeffrey Epstein A Foot Massage On Lolita Express,1347.0,rbvbxs,https://i.redd.it/s4alo2snkc481.jpg,398.0,1638981781.0,,conspiracy,Epstein
215,"Whistleblower, FBI Special Agent Steve Friend said he was taken off of human trafficking / child exploitation cases to focus on 1/6 nobodies. Pay no attention to the Epstein network that is deeply rooted in the system.",1353.0,xlh1n8,https://i.redd.it/nvij0jfhvhp91.png,142.0,1663889694.0,,conspiracy,Epstein
216,"Prince Andrew accuser, Virginia Roberts, calls for 2020 to be 'the year we take down the 1% who think they're above the law' in New Year's message which appears to slam powerful friends of Jeffrey Epstein",1348.0,eim2s0,https://www.dailymail.co.uk/news/article-7841951/Virginia-Roberts-tweets-New-Years-wish-Jeffrey-Epsteins-powerful-friends-face-justice.html,93.0,1577905145.0,,conspiracy,Epstein
217,#EpsteinSuicideCoverUp was just pulled from Twitters trending page suddenly despite being at the top for over 24 hours,1340.0,cp7ylp,https://www.reddit.com/r/conspiracy/comments/cp7ylp/epsteinsuicidecoverup_was_just_pulled_from/,112.0,1565587366.0,Title really says it all I have been on twitter reading tweets about the Epstein situation almost all day. Just within minutes it went from the 2nd highest trending hashtag to not being present on the trending section  at all.,conspiracy,Epstein
218,Disgraced Jeffrey Epstein Suspected Of Attempting Suicide Behind Bars,1341.0,chhxj4,https://radaronline.com/exclusives/2019/07/jeffrey-epstein-suspected-suicide-scandal/,531.0,1564022786.0,,conspiracy,Epstein
219,Human sex trafficking is a truth the public cannot handle,1328.0,ccqmf5,https://www.reddit.com/r/conspiracy/comments/ccqmf5/human_sex_trafficking_is_a_truth_the_public/,288.0,1563031990.0,"It amazes me how little the Epstein story is discussed and why there is no access to answers anywhere. It is rather obvious what is going on, and how governments in the US and abroad are suppressing it. It is most likely because it’s the most lucrative business known to man (how did Epstein get his wealth ?). The evidence isn’t even hidden really, it’s actually rather pervasive. Yet, not one media outlet is truly trying to blow this practice open. You can try to call organizations about it for general info, but they will immediately redirect you to their generic bullshit website where they don’t even hit actual statistics. If it is know the NY penn station is a capital for human trafficking, why won’t the NYPD even TRY to get to the bottom of it. They ( and the public as well) are just told it is a hoax in terms of scale. For all I know, someone reading this right now has purchased or took part in child sex abuse. They are out there and more common than one would think. It’s a secret people will do whatever to stick with them and only them until they die. It’s up to you. You can sit back and enjoy ignorant bliss of nativity, or we can do something about it as a whole. People are fucked up, we know this. Enough is enough.",conspiracy,Epstein
220,ok dude im now 100% positive the Austalian Media is corrupt and Purposely Not reporting on epstein,1324.0,cfw0x1,https://www.reddit.com/r/conspiracy/comments/cfw0x1/ok_dude_im_now_100_positive_the_austalian_media/,211.0,1563689916.0,"anyone else live in Australia and notice not a single story being reported on ? i swear these fucking cunts are doing nothing but feeding the public huge distraction storys  from the real news going on in the world , all i am seeing see is stupid storys about British oil tankers being attacked and lots of Random Violent murders in the counrty....all within the past few days. i hate to say this but im pretty sure this epstein case is going to get simmered down and every one will move along and forget the fact he raped literal children on the island",conspiracy,Epstein
221,Funny how that works,1323.0,101s5n7,https://i.redd.it/bp929ln8gr9a1.jpg,44.0,1672704152.0,,conspiracy,Epstein
222,Etherscan wallet named >EPSTEIN with the tracker ID WHACKD wakes up after being asleep. Starts sending unknown addresses. McAfee may not be bluffing about a deadman’s switch...,1313.0,o6rwz3,https://i.redd.it/tdxonorxm4771.jpg,172.0,1624502662.0,,conspiracy,Epstein
223,Jeffrey Epstein prison guards admit to falsifying records,1310.0,ni6gef,https://fox5atlanta.com/news/jeffrey-epstein-prison-guards-admit-to-falsifying-records,71.0,1621642121.0,,conspiracy,Epstein
224,Gary Webb's family says his death was Suicide. OR was he like Epstein? The CIA admits used the media to ruin his career. A secret deal allowed drugs to go unreported by the DCI. Maxine Waters found a govt employee ran the South Central LA drug ring & The DOJ removed that section of the report,1305.0,f1fmpw,https://i.redd.it/e6elpn95wyf41.jpg,147.0,1581284450.0,,conspiracy,Epstein
