,title,score,id,url,comms_num,created,body,subreddit,query
0,Harvey Weinstein pretending to be recovering from surgery as he shows up to a bail hearing weeks before his trial starts. Then he's seen strolling around Target a few days later. The Bill Cosby strategy to look frail and broken in order to gain sympathy from the judge and potential jury.,14048.0,ebf1a1,https://i.redd.it/2osh0h08wz441.png,739.0,1576502340.0,,conspiracy,Harvey Weinstein
1,Sacha Baron Cohen filmed a scene in 'Who is America' about pedophilia. What happened was so shocking that it was cut from the show. (Interview),8654.0,a7szl9,https://www.reddit.com/r/conspiracy/comments/a7szl9/sacha_baron_cohen_filmed_a_scene_in_who_is/,882.0,1545269897.0,"BARON COHEN: And there was an interview that didn’t make it in, with Gio. We were shooting some of this at the time of Harvey Weinstein. We wanted to investigate how does someone like Harvey Weinstein gets away with doing what…get away with criminality, essentially. And the network that surrounds him. We decided that Gio would interview a concierge in Las Vegas. During the interview, I revealed that basically Gio has molested an eight-year-old boy. Now, mind you, this is extreme comedy and we thought that the guy would leave the room. Instead, this concierge stays in the room and I go, listen, you’ve got to help me get rid of the problem. And this guy starts advising Gio how to get rid of this issue. We even at one point talk about murdering the boy, and the concierge is just saying, ‘well, listen, I’m really sorry. In this country, we can’t just drown the boy. This is America we don’t do that.’ And then, in the end, he puts me in touch with a lawyer who can silence the boy. I became really dark stuff. And then at the end of the interview I say, listen, I want to go out and celebrate now. Can you get me a date for tonight? He says, ‘what do you mean, a date?’

I go, you know, like a young man. He says, ‘well, what kind of age?’ I say, lower than Bar Mitzvah but older than eight. And he says, ‘yeah, I can put you in touch with somebody who can get you some boys like that.’

DEADLINE: None of this remotely qualifies as comedy. What did you do?

BARON COHEN: We immediately turned over the footage to the FBI because we thought, perhaps there’s a pedophile ring in Las Vegas that’s operating for these very wealthy men. And this concierge had said that he’d worked for politicians and various billionaires. But in the end the FBI decided not to pursue it.

DEADLINE: Not surprising you didn’t put it in the show…

BARON COHEN: It was too dark and wrong. In a journalistic way it was fascinating, but it was so extreme and so dark that it was too unsettling for the audience.


Edit: [Sauce](https://deadline.com/2018/12/sacha-baron-cohen-who-is-america-shocking-scenes-donald-trump-dick-cheney-sarah-palin-oj-simpson-golden-globe-nomination-interview-1202522910/)

Thanks for promoting this post with reddit gold.",conspiracy,Harvey Weinstein
2,"Leave Pizzagate aside, leave your politics at the door, and just look at the huge amount of publicly available information on pedo rings. It's absolutely insane that all of this is usually ignored while pizzagate takes the spotlight.",6376.0,8lxaoo,https://www.reddit.com/r/conspiracy/comments/8lxaoo/leave_pizzagate_aside_leave_your_politics_at_the/,491.0,1527205365.0,"- CBS 60 Minutes on the Elite Worldwide Pedophile Network. [30:00] https://www.youtube.com/watch?v=eRrSnHTZVDQ

- New York Times article from 1982: ""Prostitution rings are providing young boys to male customers in Washington and are reportedly selling information about their clients' sexual preferences to foreign intelligence services, a private investigator testified yesterday."" http://www.nytimes.com/1982/07/27/nyregion/boy-sex-rings-said-to-peddle-client-data-to-foreign-agents.html

- Under the ‘Kentler Experiment’ of the 1970s, Berlin welfare authorities handed over homeless teenagers to known paedophiles. In most cases they were asked to care for 13 - 15-year-old drug addicts and prostitutes. “It is simply unimaginable that something like this happened with state oversight.” https://www.irishtimes.com/life-and-style/health-family/germany-s-secret-paedophilia-experiment-1.2897942


- [Woman went on Dr Phil Show exposing international pedophile ring, says she was sold to a trafficking organization as a newborn. ""I traveled all over the world to have sex with them. They were all extremely rich, prominent members of society.""](https://www.youtube.com/watch?v=7QECKth6fws) [4:14] In another clip, she says she was forced to have sex [before she could talk.](https://www.youtube.com/watch?v=Xfeh_ZBa8aY) [2:33]

- Members of a U.N. peacekeeping mission engaged in ""transactional sex"" with more than 225 Haitian women in exchange for food and medication, a sign that sexual exploitation remains significantly underreported in such missions. About a third of alleged sexual abuse involves minors under 18. http://archive.is/ixbDa

- Former Senior United Nations Official Facing Pedophilia Charges in Nepal. One of the world’s leading experts on humanitarian work with street children and children affected by war has been arrested on pedophilia charges. An initial investigation claims the 60-year-old had offered children foreign trips and better education before sexually abusing them. http://www.newsweek.com/former-senior-united-nations-official-facing-pedophilia-charges-nepal-876783

- A new report commissioned by the Colombian government and FARC rebels has concluded U.S. soldiers and military contractors sexually abused at least 54 children in Colombia between 2003 and 2007. The investigator cites one case where 53 girls in the town of Melgar were targeted by contractors who filmed the abuse and sold the films as pornography. In another case, a 12-year-old girl was allegedly drugged and raped by a U.S. Army sergeant and a contractor. Under immunity agreements, none of the alleged abusers were ever punished. The media group FAIR notes the story has received no coverage in the U.S. corporate media. A number of U.S. outlets have reported on a new Justice Department probe which concludes U.S. drug enforcement agents in Colombia participated in ""sex parties"" with prostitutes hired by Colombian drug cartels. http://archive.is/0iSv4 (5th story down on this page)

- Pedophile-ring in UK Parliament https://www.washingtonpost.com/news/morning-mix/wp/2014/07/07/a-big-political-cover-up-of-1980s-pedophile-ring-in-u-k-parliament/

- Former Republican House Speaker Dennis Hastert on Wednesday admitted to sexually abusing teenage boys during his time as a high school wrestling coach in a Chicago suburb before his career as an elected official. http://www.cbsnews.com/news/alleged-sex-abuse-victim-of-dennis-hastert-identifies-himself-publicly/

- Highly connected Billionaire and convicted pedo Jeffery Epstein only serves  13 month sentence. Numerous allegations surface, including that he used underaged girls for blackmail on politicians and others. https://www.theguardian.com/world/2015/jan/10/jeffrey-epstein-decade-scandal-prince-andrew

- O.K. Boys Ranch: Much of the Boys Ranch staff was, at best, indifferent to the suffering. At worst, concluded a state investigation, some staff members sodomized and beat the boys themselves.  http://community.seattletimes.nwsource.com/archive/?date=19951214&slug=2157707

- Discovery Channel Documentary - ""Conspiracy of Silence"" https://www.youtube.com/watch?v=vBSIDQt5Dwc

Hollywood:

- Hollywood’s Other ‘Open Secret’ Besides Harvey Weinstein: Preying on Young Boys  https://www.thedailybeast.com/hollywoods-other-open-secret-besides-harvey-weinstein-preying-on-young-boys

- Child sexual abuse cases in Hollywood attract attention http://articles.latimes.com/2012/jan/08/business/la-fi-ct-hollywood-molesters-20120109

- The Pedophile Director Embraced by Hollywood-  Filmmaker Victor Salva was convicted of raping a 12-year-old boy. But his new film, ‘Jeepers Creepers 3,’ is now playing in theaters. Why has Hollywood given this monster a pass? https://www.thedailybeast.com/the-pedophile-director-embraced-by-hollywood

- Actor Corey Feldman Says Pedophilia No. 1 Problem for Child Stars http://abcnews.go.com/Entertainment/corey-feldman-pedophilia-problem-child-actors-contributed-demise/story?id=14256781

- Kevin Spacey apologizes, comes out as gay to confuse the public after allegation of sexual advance on 14-year-old http://abcnews.go.com/Entertainment/choose-now-live-gay-man-kevin-spacey-emotional/story?id=50804057

Unfortunately, this is so common in Hollywood that it's considered ""an open secret."" 

I highly recommend this documentary *An Open Secret* (on Pedos in Hollywood with testimony from stars, court cases, etc, 1:40:00): https://vimeo.com/142444429

And finally...

- Several of the children who Cameron experimented on were sexually abused, in at least one case by several men. One of the children was filmed numerous times performing sexual acts with high-ranking federal government officials, in a scheme set up by Cameron and other MKULTRA researchers, to blackmail the officials to ensure further funding for the experiments. https://en.wikipedia.org/wiki/Unethical_human_experimentation_in_the_United_States#Founding",conspiracy,Harvey Weinstein
3,"For 15 years, Andrew Cuomo was married to Kerry Kennedy (Robert and Ethel Kennedy's 7th child). They were both in Epstein's Black Book. Why did he halt a Harvey Weinstein probe and accept $25,000 from Weinstein's law firm? Why did his brother, Chris, not want people looking into Epstein's friends?",5115.0,j7dm7r,https://i.redd.it/3xjojge7ovr51.jpg,335.0,1602165874.0,,conspiracy,Harvey Weinstein
4,Here is a list of all US politicians Charged/Convicted of Sex Crimes against minors,4505.0,cbxabp,https://www.reddit.com/r/conspiracy/comments/cbxabp/here_is_a_list_of_all_us_politicians/,503.0,1562860596.0,"#Republicans

Republican Speaker of the House Dennis Hastert was indicted on federal charges of structuring bank withdrawals after prosecutors alleged Hastert had molested at least four boys as young as 14 and attempted to compensate his victims and subsequently conceal the transactions. Hastert eventually admitted that he sexually abused the boys whom he had coached decades earlier, and was sentenced to fifteen months in prison.

Republican Tim Nolan, chairman of Donald Trump’s presidential campaign in Kentucky, pled guilty to child sex trafficking and on February 11, 2018 he was sentenced to serve 20 years in prison. 

Republican state Senator Ralph Shortey was indicted on four counts of human trafficking and child pornography. In November 2017, he pleaded guilty to one count of child sex trafficking in exchange for the dropping of the other charges.

Republican anti-abortion activist Howard Scott Heldreth is a convicted child rapist in Florida.

Republican County Commissioner David Swartz pleaded guilty to molesting two girls under the age of 11 and was sentenced to 8 years in prison.

Republican judge Mark Pazuhanich pleaded no contest to fondling a 10-year old girl and was sentenced to 10 years probation.

Republican anti-abortion activist Nicholas Morency pleaded guilty to possessing child pornography on his computer and offering a bounty to anybody who murders an abortion doctor.

Republican legislator Edison Misla Aldarondo was sentenced to 10 years in prison for raping his daughter between the ages of 9 and 17.

Republican Mayor Philip Giordano is serving a 37-year sentence in federal prison for sexually abusing 8- and 10-year old girls.

Republican campaign consultant Tom Shortridge was sentenced to three years probation for taking nude photographs of a 15-year old girl.

Republican pastor Mike Hintz, whom George W. Bush commended during the 2004 presidential campaign, surrendered to police after admitting to a sexual affair with a female juvenile.

Republican legislator Peter Dibble pleaded no contest to having an inappropriate relationship with a 13-year-old girl.

Republican Congressman Donald “Buz” Lukens was found guilty of having sex with a female minor and sentenced to one month in jail.

Republican fundraiser Richard A. Delgaudio was found guilty of child porn charges and paying two teenage girls to pose for sexual photos.

Republican activist Mark A. Grethen convicted on six counts of sex crimes involving children.

Republican activist Randal David Ankeney pleaded guilty to attempted sexual assault on a child.

Republican Congressman Dan Crane had sex with a female minor working as a congressional page.

Republican activist and Christian Coalition leader Beverly Russell admitted to an incestuous relationship with his step daughter. Republican congressman and anti-gay activist Robert Bauman was charged with having sex with a 16-year-old boy he picked up at a gay bar.

Republican Committee Chairman Jeffrey Patti was arrested for distributing a video clip of a 5-year-old girl being raped.

Republican activist Marty Glickman (a.k.a. “Republican Marty”), was taken into custody by Florida police on four counts of unlawful sexual activity with an underage girl and one count of delivering the drug LSD.

Republican legislative aide Howard L. Brooks was charged with molesting a 12-year old boy and possession of child pornography. Republican Senate candidate John Hathaway was accused of having sex with his 12-year old baby sitter and withdrew his candidacy after the allegations were reported in the media.

Republican preacher Stephen White, who demanded a return to traditional values, was sentenced to jail after offering $20 to a 14-year-old boy for permission to perform oral sex on him.

Republican talk show host Jon Matthews pleaded guilty to exposing his genitals to an 11 year old girl.

Republican anti-gay activist Earl “Butch” Kimmerling was sentenced to 40 years in prison for molesting an 8-year old girl after he attempted to stop a gay couple from adopting her.

Republican Party leader Paul Ingram pleaded guilty to six counts of raping his daughters and served 14 years in federal prison.

Republican election board official Kevin Coan was sentenced to two years probation for soliciting sex over the internet from a 14-year old girl.

Republican politician Andrew Buhr was charged with two counts of first degree sodomy with a 13-year old boy.

Republican politician Keith Westmoreland was arrested on seven felony counts of lewd and lascivious exhibition to girls under the age of 16 (i.e. exposing himself to children).

Republican anti-abortion activist John Allen Burt was charged with sexual misconduct involving a 15-year old girl. 

Republican County Councilman Keola Childs pleaded guilty to molesting a male child.

Republican activist John Butler was charged with criminal sexual assault on a teenage girl.

Republican candidate Richard Gardner admitted to molesting his two daughters.

Republican Councilman and former Marine Jack W. Gardner was convicted of molesting a 13-year old girl.

Republican County Commissioner Merrill Robert Barter pleaded guilty to unlawful sexual contact and assault on a teenage boy. Republican City Councilman Fred C. Smeltzer, Jr. pleaded no contest to raping a 15 year-old girl and served 6-months in prison. Republican activist Parker J. Bena pleaded guilty to possession of child pornography on his home computer and was sentenced to 30 months in federal prison and fined $18,000.

Republican parole board officer and former Colorado state representative, Larry Jack Schwarz, was fired after child pornography was found in his possession.

Republican strategist and Citadel Military College graduate Robin Vanderwall was convicted in Virginia on five counts of soliciting sex from boys and girls over the internet.

Republican city councilman Mark Harris, who is described as a “good military man” and “church goer,” was convicted of repeatedly having sex with an 11-year-old girl and sentenced to 12 years in prison.

Republican businessman Jon Grunseth withdrew his candidacy for Minnesota governor after allegations surfaced that he went swimming in the nude with four underage girls, including his daughter.

Republican director of the “Young Republican Federation” Nicholas Elizondo molested his 6-year old daughter and was sentenced to six years in prison.

Republican benefactor of conservative Christian groups, Richard A. Dasen Sr., was charged with rape for allegedly paying a 15-year old girl for sex. Dasen, 62, who is married with grown children and several grandchildren, has allegedly told police that over the past decade he paid more than $1 million to have sex with a large number of young women.

Republican Former Mayor of Stockton, California, Anthony Silva, was charged with providing alcohol to young adults during a game of strip poker that included a 16-year-old boy at a camp for underprivileged children run by the mayor.

#Democrats

Democratic donor and billionaire, Jeffrey Epstein, ran an underage child sex brothel and was convicted of soliciting underage girls for prostitution. 

Democratic New York Congressman, Anthony Weiner, plead guilty to transferring obscene material to a minor as part of a plea agreement for sexted and sending Twitter DMs to underage girls as young as 15.

Democratic donor, activist, and Hollywood producer Harvey Weinstein is being criminally prosecuted and civilly sued for years of sexual abuse (that was well known “secret” in Hollywood) including underage sexual activities with aspiring female actresses. 

Democratic activist and #metoo proponent, Asia Argento, settled a lawsuit for sexual harassment stemming from sexual activities with an underage actor.

Democratic Mayor of Racine, Wisconsin, Gary Becker, was convicted of attempted child seduction, child pornography, and other child sex crimes.

Democratic Seattle Mayor Ed Murray resigned after multiple accusations of child sexual abuse were levied against him including by family members.

Democratic activist and aid to NYC Mayor De Blasio, Jacob Schwartz was arrested on possession of 3,000+ child pornographic images.

Democratic activist and actor, Russell Simmons, was sued based on an allegation of sexual assault where he coerced an underage model for sex.

Democratic Governor of Oregon, Neil Goldschmidt, after being caught by a newspaper, publicly admitted to having a past sexual relationship with a 13-year-old girl after the statute of limitations on the rape charges had expired.

Democratic Illinois Congressman, Mel Reynolds resigned from Congress after he was convicted of statutory rape of a 16-year-old campaign volunteer.

Democratic New York Congressman, Fred Richmond, was arrested in Washington D.C. for soliciting sex from a 16-year-old boy. Democratic activist, donor, and director, Roman Polanski, fled the country after pleading guilty to statutory rape of a 13-year-old girl. Democrats and Hollywood actors still defend him to this day, including, Whoopi Goldberg, Martin Scorcese, Woody Allen, David Lynch, Wim Wenders, Pedro Almodovar, Tilda Swinton and Monica Bellucci.

Democratic State Senator from Alaska, George Jacko, was found guilty of sexual harassment of an underage legislative page.

Democratic State Representative candidate for Colorado, Andrew Myers, was convicted for possession of child pornography and enticing children.

Democratic Illinois Congressman, Gus Savage was investigated by the Democrat-controlled House Committee on Ethics for attempting to rape an underage female Peace Corps volunteer in Zaire. The Committee concluded that while the events did occur his apology was sufficient and took no further action.

Democratic activist, donor, and spokesperson for Subway, Jared Fogle, was convicted of distribution and receipt of child pornography and traveling to engage in illicit sexual conduct with a minor.

Democratic State Department official, Carl Carey, under Hillary Clinton’s state department, was arrested on ten counts of child porn possession.

Democratic Maine Assistant Attorney General, James Cameron, was sentenced to just over 15 years in federal prison for seven counts of child porn possession, receipt and transmission.

Democratic State Department official, Daniel Rosen, under Hillary Clinton’s state department, was arrested and charged with allegedly soliciting sex from a minor over the internet.

Democratic State Department official, James Cafferty, pleaded guilty to one count of transportation of child pornography.

Democratic radio host, Bernie Ward, plead guilty to one count of sending child pornography over the Internet.

Democratic deputy attorney general from California, Raymond Liddy, was arrested for possession of child pornography.

Democratic Illinois State Representative, Keith Farnham, has resigned and was charged with possession of child pornography and has been accused of bragging at an online site about sexually molesting a 6-year-old girl.

Democratic spokesperson for the Arkansas Democratic Party, Harold Moody, Jr, was charged with distribution and possession of child pornography.

Democratic Radnor Township Board of Commissioners member, Philip Ahr, resigned from his position after being charged with possession of child pornography and abusing children between 2 and 6 years-old.

Democratic activist and BLM organizer, Charles Wade, was arrested and charged with human trafficking and underage prostitution.

Democratic Texas attorney and activist, Mark Benavides, was charged with having sex with a minor, inducing a child under 18 to have sex and compelling prostitution of at least nine legal clients and possession of child pornography. He was found guilty on six counts of sex trafficking.

Democratic Virginia Delegate, Joe Morrissey, was indicted on charges connected to his relationship with a 17-year-old girl and was charged with supervisory indecent liberties with a minor, electronic solicitation of a minor, possession of child pornography and distribution of child pornography.

Democratic Massachusetts Congressman, Gerry Studds, was censured by the House of Representatives after he admitted to an inappropriate relationship with a 17-year-old page.

Democratic Former Mayor of Stillwater, New York, Rick Nelson was plead guilty to five counts of possession of child pornography of children less than 16 years of age.

Democratic Former Mayor of Clayton, New York, Dale Kenyon, was indicted for sexual acts against a teenager.

Democratic Former Mayor of Hubbard, Ohio, Richard Keenan, was given a life sentence in jail for raping a 4-year-old girl.

Democratic Former Mayor of Winston, Oregeon, Kenneth Barrett, was arrested for setting up a meeting to have sex with a 14-year-old girl who turned out to be a police officer.

Democratic Former Mayor of Randolph, Nebraska, Dwayne L. Schutt, was arrested and charged with four counts of felony third-degree sexual assault of a child and one count of intentional child abuse.

Democratic Former Mayor of Dawson, Georgia, Christopher Wright, was indicted on the charges of aggravated child molestation, aggravated sodomy, rape, child molestation and statutory rape of an 11-year-old boy and a 12-year-old girl.

Democratic Former Mayor of Millbrook, New York, Donald Briggs, was arrested and charged with inappropriate sexual contact with a person younger than 17.

Democratic party leader for Victoria County, Texas, Stephen Jabbour, plead guilty to possession and receiving over half a million child pornographic images.

Democratic activist and fundraiser, Terrence Bean, was arrested on charges of sodomy and sex abuse in a case involving a 15-year-old boy and when the alleged victim declined to testify, and the judge dismissed the case.

Democratic Party Chairman for Davidson County, Tennessee, Rodney Mullin, resigned amid child pornography allegations. Democratic activist, Andrew Douglas Reed, pleaded guilty to a multiple counts of 2nd-degree sexual exploitation of a minor for producing child pornography.

Democratic official from Terre Haute, Indiana, David Roberts was sentenced to federal prison for producing and possessing child pornography including placing hidden cameras in the bedrooms and bathrooms at a home he shared with two minor female victims.

Democratic California Congressman, Tony Cárdenas, is being sued in LA County for allegedly sexually abused a 16-year-old girl. Democratic aide to Senator Barbara Boxer, Jeff Rosato, plead guilty to charges of trading in child pornography.

Democratic Alaskan State Representative, Dean Westlake, resigned from his seat after the media published a report alleging he fathered a child with a 16-year-old girl when he was 28. Democratic New Jersey State Assemblyman, Neil Cohen, was convicted of possession and distribution of child pornography.

Democratic (later turned Republican) Senator Strom Thurmond, a notable racist, had sex with a 15-year old black girl which produced a child.

#Libertarian

#Green

Edit: Not everyone on this list is a politician. Some political activists are included.

If there are any other individuals that belong on this list and aren't, please let me know so we can get them added.

Edit 2: I realized that I just copy and pasted these links from another user's posts, and have not independently verified each of these claims myself. If anyone sees someone on this list that *shouldn't* be, please DM me so I can have them removed. Though after randomly checking a few of the names, it appears that these are all legitimate cases.",conspiracy,Harvey Weinstein
