,title,score,id,url,comms_num,created,body,subreddit,query
89,The Media Conspiracy Surrounding Michael Jackson is Very Real,231.0,arwew3,https://www.reddit.com/r/conspiracy/comments/arwew3/the_media_conspiracy_surrounding_michael_jackson/,38.0,1550490082.0,"> Michael was one of the nicest, kindest people I’ve ever met… He was nice. He was kind. He was well-meaning. He liked to see people do well, and he liked to use his reputation and resources to help disabled people, children from the inner city who grew up in poverty and violence. He liked to see people happy… **He was somewhat naive when it came to the forces of evil circling around him and trying to destroy him. He didn’t quite believe that was going to happen and unfortunately, they put him through a nightmare…**

In [May of this year](https://www.vulture.com/2019/01/harvey-weinstein-case-trial-date.html), with some [seventy odd women](https://www.vulture.com/2017/10/the-harvey-weinstein-sexual-harassment-assault-accusations.html) accusing him of sexual assault, Harvey Weinstein will finally appear in court. 

One of the wealthiest, most powerful men in the media industry, the catalyst of the MeToo Movement, and yet the media coverage of Weinstein has basically gone silent.

Instead, the media is going into absolute overdrive to rehash and dredge up every tired old story about a man who was completely vindicated in a court of law in 2005 and has been dead for almost a decade: Michael Jackson.

For the first half of his life, he was beloved. An adorable child star, a proficient dancer as a teen, and the golden boy who revived a dying music industry with his seminal album, *Thriller*. But then, as though it were overnight, things changed.

> He will not swiftly be forgiven for having turned so many tables, for he damn sure grabbed the brass ring, and the man who broke the bank at Monte Carlo has nothing on Michael.

James Baldwin’s [words](http://challengingmalesupremacy.org/wp-content/uploads/2015/04/Here-be-Dragons-James-Baldwin.pdf) on Jackson’s success seem prophetic now, some 34 years after he made them.

The turning point, of course, between the media’s love for the childlike and naive singer and their hatred began when Jackson [purchased the most lucrative and important catalogue of songs](https://en.wikipedia.org/wiki/Sony/ATV_Music_Publishing#Sale_of_ATV_Music_to_Michael_Jackson) in the music industry in 1985: ATV Music, which included the Lennon/McCartney [AKA The Beatles] songs. Even to this day, the media keeps peddling the myth that Jackson outbid Paul McCartney. He didn’t. McCartney had first right of refusal *twice* - both times he said he wasn’t interested.

> …Overnight they called me a freak. They called me a homosexual. They called me a child molester. They said I bleached my skin. **They said everything to turn the public against me.**

Fame and success isn’t all what it’s cracked up to be.

In late 2017, investigation into [Weinstein’s Complicity Machine](https://www.nytimes.com/interactive/2017/12/05/us/harvey-weinstein-complicity.html) revealed the media bias against Jackson wasn’t a conspiracy: it was a **FACT**:


> Shortly after the news investigations of Weinstein’s alleged abuse were published, A. J. Benza, a former *New York Daily News* gossip columnist, received a two-word text from Weinstein: “Help me.”

> Benza had been integral to the network of friendly journalists — gossip columnists, magazine writers, editors and authors — whom Weinstein relied on to deflect threats.

> Benza had a suggestion. “I could supply your P.R. girls with a lot of gossip — a lot of stories — and if people come at them with the ‘Harvey’s having an affair story,’ they can barter,” Benza recalled telling Weinstein. “He said, ‘A. J., it’s got to be good stories,’ and I said, ‘Don’t you worry about it.’”

> Collecting a monthly retainer, Benza said, he reported items on Roger Clemens, **Michael Jackson** and others and sent them to Weinstein’s communications team.

In one such story, online by gossip website [*Radar Online*](https://en.wikipedia.org/wiki/Radar_Online) peddled a **fake** [“police report""](https://themichaeljacksonallegations.com/2016/12/27/has-child-pornography-ever-been-found-in-michael-jacksons-possession/) which the Sheriff's Department who investigated Jackson themselves stated was ‘falsified, with images that were never part of the original documents,' claiming those images 'appeared to have been taken from internet sources.' [There were contents on the fake report which didn't even exist in 2005](https://www.cbc.ca/news/canada/ottawa/ottawa-artist-photo-michael-jackson-1.3651598).

True crime author Aphrodite Jones remarks:

> Michael Jackson had become and illusion set by a media machine. It was a machine that made millions by perpetuating the notion that Jackson was a freak. It was a dangerous machine that ultimately tried to bring the icon down, and after all, it was a media effort, the [Bashir documentary](https://en.wikipedia.org/wiki/Living_with_Michael_Jackson#Criticism), that landed Jackson in the Santa Maria court in the first place. [Martin Bashir](https://www.smh.com.au/entertainment/celebrity/tables-turned-as-jacksons-lawyer-grills-bashir-20050303-gdkuar.html) had made a name for himself based on Jackson’s goodwill, and somehow Michael Jackson had been brought to face criminal charges because of it.

She continues,

> Jackson’s exoneration actually cost the worldwide media billions of dollars. Apparently, had Michael Jackson been sent to prison, the tabloid business would have started a cottage industry of reports about Jackson’s safety in jail, about Jackson’s life behind bars, about Jackson’s suicide watches, about Jackson’s prison inmates, and the feeding frenzy would have continued… Wild rumours would have abounded, selling people on the idea that Jackson was crazier than ever before - fueling supermarket tabloids in perpetuity.

Now, HBO and Channel 4 will air a [four hour long film](https://www.forbes.com/sites/joevogel/2019/01/29/what-you-should-know-about-the-new-michael-jackson-documentary/#32875ef640fa) focused on nothing but two already discredited accusers who have had their lawsuit seeking hundreds of millions of dollars dismissed from court, pending an appeal.

Wade Robson and James Safechuck, who feature in the film, have been caught in a litany of inconsistencies, contradictions, half-truths, or full blown lies. And yet numerous “journalists” have taken their allegations as the gospel truth, doing nothing to research the men or question their words.

But in this sensitive MeToo and TimesUp moral panic, anyone who questions or scrutinises a person’s accusations of sexual assault is immediately attacked, condemned and labeled a “victim blamer” or a “predator apologist.”

But *the fact remains* that both of these men’s accusations lack credibility and have undeniable doubt surrounding them.

Wade Robson’s allegations have been [meticulously chronicled](https://themichaeljacksonallegations.com/the-wade-robson-allegations/) using court transcripts, interviews, testimony, depositions, and business papers. In fact, the biggest thing which casts doubt over Robson’s accusations are his own inconsistencies and lies which he catches himself in.

[This 30-minute video exposé gives a condensed summary of his story](https://www.youtube.com/watch?v=rgSbSotJgUY).

James Safechuck’s credibility is also severely undermined by the inconsistencies and lies he also catches himself in.

There is also overwhelming evidence that Safechuck and Robson have [lifted huge elements of their accusations from the thoroughly discredited and pro-pedophilia writings](https://twitter.com/Hammertonhal/status/1085620426536112129?s=20) of Victor Gutierrez. Gutierrez claims his 1996 book was based on the ‘secret diary’ of the teen at the centre of the [1993 allegations](https://themichaeljacksonallegations.com/the-1993-allegations/). The only problem was that not only did the teen, Jordan Chandler, **not** keep a diary, he did **not** speak to the press, did **not** speak to Victor Gutierrez, and he claimed in a sworn legal declaration that he *never even met* Gutierrez!

But the press won’t tell you that.

Even in the latest re-hashing of the 1993 allegations, the press seems to purposefully overlook the fact that Evan Chandler owed some $70,000 in child support payments, had repeatedly asked for money and movie deals from Michael Jackson, and even asked Jackson to *build him a new house* before threatening to accuse him of molesting his son.

In fact, Michael Jackson had *multiple* opportunities to “pay off” Chandler before the story hit the media and police. But Jackson refused: he always maintained his complete and utter innocence.

Neither will the press tell you that prior to the allegations even being made, Evan was [secretly recorded](https://themichaeljacksonallegations.com/2016/12/26/taped-phone-conversations-between-evan-chandler-and-david-schwartz-on-july-8-1993/) **plotting against Jackson** [(listen to it here)](https://www.youtube.com/watch?v=tx8Z9fxxw-U).

And when Jordan Chandler repeatedly said Jackson had *not* abused him? Evan, a dentist, *sedated* his son [with Sodium Amytal](https://www.psychologytoday.com/us/blog/the-skeptical-psychologist/200907/michael-jackson-truth-serum-and-false-memories), a drug which [affects a person's memories and makes them susceptible to suggestion](https://en.wikipedia.org/wiki/Amobarbital) when he got the confession out.

> “It’s a psychiatric medication that cannot be relied on to produce fact,” [says Dr. Resnick, the Cleveland psychiatrist.](http://www.buttonmonkey.com/misc/maryfischer.html) “People are very suggestible under it. People will say things under sodium Amytal that are blatantly untrue.”

**DON’T** be taken for a fool. **DON’T** let the media *lie to you*. **DON’T** be deceived and **DON'T** be distracted from *real* sexual predators.

During the media feeding frenzy, *National Enquirer* offered a man [**$200,000 to say Jackson molested his sons**](https://www.foxnews.com/story/former-protege-vouches-for-jacko), knowing full well that it would be a lie.

> ""He said, 'Say he grabbed you on the butt. Say he grabbed you and touched you in any kind of way,'"" Newt said. ""He told us he took all these people down. Now he was going to take Michael down. That he would really destroy him. He told us he took all these other famous people down. All the major people that had scandals against them. He said, 'We take these people down. That's what we do.'""

> 'Say he touched you. All you have to do is say it. But you might have to take the stand. You might have to go on *Oprah* in front of all these people. You have to be prepared for this thing. **Just say it. And we'll give you money**'

> ""He was trying to coach me — if I decided to take the money, what would happen. He said 'You know, it's going to be a huge scandal. You'll probably have a lot of people not liking you. You're going to be famous!' But to me, you'd be ruined. And the truth is Michael **didn't do anything even close to trying to molest us**.""

Michael Jackson was [thoroughly investigated by the FBI](http://charlesthomsonjournalist.blogspot.com/2010/01/fbi-files-support-jacksons-innocence.html), one of the most powerful and well funded investigative bodies in the world, for more than a *decade* and found **nothing** which indicated Jackson was guilty of the crimes he was accused of.

This is a man who gets utter glee having water-balloon fights and climbing trees to write songs like “[Heal The World](https://www.youtube.com/watch?v=BWf-eARnf6U)."" Do you *really* think **the FBI** couldn’t catch him on *something*?

For further information, I will link some highly interesting websites and resources for you to do your own research.

* *Frontline*: “[Tabloid Truth: The Michael Jackson Story](https://www.youtube.com/watch?v=Ldc61tv-EgE)."" This incredible documentary goes into the media frenzy following the 1993 allegations and how the tabloids were shelling out hundreds of thousands of dollars for fake stories to put in the papers.


* [30-minute video](https://www.youtube.com/watch?v=4BetCnNjN3k) which breaks down both the 1993 and 2005 allegations.

* ""[Wade Robson: The Real Story](https://www.youtube.com/watch?v=rgSbSotJgUY)."" A 30-minute exposé which breaks down Wade Robson’s allegations.

* *Debunking Leaving Neverland Lie-by-Lie*: “[It’s Not About Money](https://www.youtube.com/watch?v=Koc1dcRBIUc)”

* *Debunking Leaving Neverland Lie-by-Lie*: “[Not A Night Went By…](https://www.youtube.com/watch?v=8qvnzlvDuSY)”

* [20-minute video](https://www.youtube.com/watch?v=ELybOHbfiH8&amp;feature=youtu.be) which breaks down *why* Michael Jackson settled the 1993 civil lawsuit and explains how the settlement did *not* prevent the Chandler’s from testifying against him in court.

* [*True Crime with Aphrodite Jones*: “Michael Jackson”](https://www.youtube.com/watch?v=6Cn1xQZ-IFc) a 40-minute documentary which goes through the 2005 trial and the media circus surrounding it.

* “[Victor Gutierrez and his role in the allegations against Michael Jackson](https://themichaeljacksonallegations.com/2016/12/26/victor-gutierrez-and-his-role-in-the-allegations-against-michael-jackson/).” The detailed and highly researched article investigates this pro-pedophilia advocate and his obsession with peddling fake stories about Michael Jackson.

* “[What You Should Know About the New Michael Jackson Documentary](https://www.forbes.com/sites/joevogel/2019/01/29/what-you-should-know-about-the-new-michael-jackson-documentary/#7f600231640f)"" by esteemed academic Joseph Vogel.

* “[Michael Jackson Is Innocent](https://old.reddit.com/r/MichaelJackson/comments/afnz1w/michael_is_innocent/)."" A highly detailed Reddit post by user /u/Damdamfino

* ”[Was Michael Jackson Framed?](https://mjjtruthnow.wordpress.com/2014/05/20/was-michael-jackson-framed-the-defining-1994-gq-article-by-mary-a-fischer-that-set-the-record-straight-on-the-1993-allegations/)"" by Mary A. Fischer for GQ Magazine, October 1994. This meticulously researched piece of investigative journalism examines the events and people involved in Jackson's 1993 accusation/ extortion attempt.

* “[One of the Most Shameful Episodes In Journalistic History](https://www.huffingtonpost.com/charles-thomson/one-of-the-most-shameful_b_610258.html)."" By multiple award winning journalist Charles Thomson. Thomson examines the court transcripts of the 2005 trial and compares them to the media coverage at the time and outlines how many of the crucial details which pointed to Jackson's defence went completely unreported. YouTube user, TabloidJunk, narrates Thomson's article and adds supporting [video footage if you would prefer to watch that instead](https://www.youtube.com/watch?v=xpzAtdQN56c).

* *Reason Bound Podcast*, episode 10: ""[Pirates In Neverland: The Michael Jackson Allegations](https://www.youtube.com/watch?v=9J1JQaIrxRU)."" Host Ryan Michaels and guest, multiple award winning journalist Charles Thomson, break down everything that happened between 1993 and 2005 and explain the Michael Jackson allegations in great detail. A very absorbing and compelling podcast to listen to.",conspiracy,Harvey Weinstein
90,Harvey Weinstein's Lawyer Quits After Two Days As Democrats Scramble to Distance Themselves,229.0,751znu,http://www.zerohedge.com/news/2017-10-07/harvey-weinsteins-lawyer-quits-after-two-days-democrats-scramble-distance-themselves,27.0,1507473199.0,,conspiracy,Harvey Weinstein
91,Harvey Weinstein sued for alleged 'sex trafficking' in Cannes. Hmmm... Isn't the Island of Jersey just a short plane or ferry ride away?,224.0,7g047o,https://www.theguardian.com/film/2017/nov/27/harvey-weinstein-sued-for-alleged-sex-trafficking-in-cannes,45.0,1511830602.0,,conspiracy,Harvey Weinstein
92,Harvey Weinstein's Letter in 2009 supporting Convicted Child Rapist Roman Polanski didn't age too well... #PizzaGate #PedoWood,220.0,7lch2a,https://twitter.com/MathEasySolns/status/943950887927431168,27.0,1513890595.0,,conspiracy,Harvey Weinstein
93,"Harvey Weinstein’s Army of Spies: The film executive hired private investigators, including ex-Mossad agents, to track actresses and journalists.",219.0,7b9iel,https://www.newyorker.com/news/news-desk/harvey-weinsteins-army-of-spies,25.0,1510014803.0,,conspiracy,Harvey Weinstein
94,"Harvey Weinstein's Lawyer Gave $10,000 To Manhattan DA After He Declined To File Sexual Assault Charges",217.0,75lktn,http://www.ibtimes.com/political-capital/harvey-weinsteins-lawyer-gave-10000-manhattan-da-after-he-declined-file-sexual,7.0,1507683258.0,,conspiracy,Harvey Weinstein
95,"Ye just called out Trump for putting Israel first over America. He should watch his 6. Trump is a client of Black Cube, a Mossad private spy firm. Bill Gates dad used to be an advisor to Black Cube. Trump's failing casinos were bailed out by the founders of modern Israel",216.0,z6tilr,https://i.redd.it/wic5ir899o2a1.jpg,63.0,1669632801.0,,conspiracy,Harvey Weinstein
96,Harvey Weinstein Has Been Fired From His Company,214.0,755b2v,https://www.buzzfeed.com/kateaurthur/harvey-weinstein-investigation,33.0,1507506241.0,,conspiracy,Harvey Weinstein
97,"Psychologist who testified for the prosecution at the Harvey Weinstein trial has been hit by a car, leaving her with broken bones",216.0,fadgev,https://lawandcrime.com/high-profile/forensic-psychologist-who-testified-for-prosecution-at-harvey-weinstein-trial-was-hit-by-a-car/,15.0,1582816252.0,,conspiracy,Harvey Weinstein
98,Lana del Rey references fucking Harvey Weinstein in song - Lyrics Change 2 days ago,212.0,7632s1,https://www.reddit.com/r/conspiracy/comments/7632s1/lana_del_rey_references_fucking_harvey_weinstein/,62.0,1507877420.0,"Song - https://www.youtube.com/watch?v=X34RO0zfA4Y

2017: https://genius.com/1329071

2016: http://archive.is/UnjDo#selection-802.12-835.49


http://www.metrolyrics.com/cola-lyrics-lana-del-rey.html

https://web.archive.org/web/20130516141046/https://www.azlyrics.com/lyrics/lanadelrey/colapussy.html

https://imgur.com/a/PlzYo

edit. Capture from a few days ago - https://web.archive.org/web/20161007182134/http://genius.com/Lana-del-rey-cola-lyrics?referent_id=1329071#note-1329071
",conspiracy,Harvey Weinstein
99,Are we being manipulated into missing the most important part of these of these sexual assault/harassment charges?,201.0,7c8cow,https://www.reddit.com/r/conspiracy/comments/7c8cow/are_we_being_manipulated_into_missing_the_most/,30.0,1510406519.0,"Sexual harassment and assault have been in the news.  It's a good thing victims are able and comfortable enough to come forward but the volume and pace has pushed the spotlight off some of the most disturbing aspects of the original story. Let's walk back. 

This began with allegations against Harvey  Weinstein.  The original scandal as I recall it was more about the fact he got away with it for so long not just the acts themselves.  There was extensive reporting both the power he had over actress (a Weinstein film could and did jump start many careers) and that it was essentially an open secret in his industry.  It's fucking uncomfortable that Hollywood felt okay openly joking about it (30 rock, Seth McFarland etc). Great start but then the focus starts to shift.  We never quite got past ""lots of people"" to who really enabled him by protecting him and ""handling"" the more troublesome cases.  Why, the spacey story dropped.  That was clearly organic because it followed the same themes: **open, repeated, and enabled** .  His preference for young boys was really fucked up.  Good for Rapp for coming forward, makes complete sense similar situations. 

Here's where it starts to get hazy.  allegations start flying right and left.  Good, I guess.  Yes, all sexual harassment and assault is bad but we're starting to lose our three themes: **open, repeated, and enabled**. I guess the HW story technically fits but is an old man in a wheelchair grabbing ass really the same as exploiting the power to make or break careers for decades?  What the hell was up all the men and women outside Weinstein's orbit just passing it off like it's a normal thing?  How normal is this?  Is it just Hollywood or are their other problem industries?  Any intersection?  It's clear already somehow this stuff is getting handled.  Props to the New York Times for breaking the story but are gonna talk about how the same paper killed the same story in its infantcy only a decade ago?  Then there's the  little matter of an elected DA killing a slam dunk case.  Props to the NYPD and the courage of the victim.  It takes balls to get that proof from wearing a wire.  With all the new names coming up somehow these are one day stories. 

Then the New Yorker dropped a bombshell: [**Harvey Weinstein’s Army of Spies.**](https://www.newyorker.com/news/news-desk/harvey-weinsteins-army-of-spies?) Read it. READ ALL OF IT.  The title gives Harvey a little too much credit.  He hired a high power law firm, they hired the spies but weinstein did follow the developments personally.  So how high powered?  It's run by David Boise.   He was the lead attorney for Al Gore in Bush v Gore.  The guy's now saying it was a mistake to hire ""investigators"",.  Quick question, are most investigators former Israeli mossad agents?

*So what exactly were these ex foreign agents now for hire doing?*

>Over the course of a year, Weinstein had the agencies “target,” or collect information on, dozens of individuals, and compile psychological profiles that sometimes focussed on their personal or sexual histories.

*It gets better*

>Two private investigators from Black Cube, using false identities, met with the actress Rose McGowan, who eventually publicly accused Weinstein of rape, to extract information from her.

*Yeah, one more thing*

>The law firm and Black Cube signed a contract that month and several others later. One, dated July 11, 2017, and bearing Boies’s signature, states that the project’s “primary objectives” are to “provide intelligence which will help the Client’s efforts to completely stop the publication of a new negative article in a leading NY newspaper” and to “obtain additional content of a book which currently being written and includes harmful negative information on and about the Client,”

*Lastly*

>Weinstein’s relationship with Kroll, one of the other agencies he contracted with, dates back years.

So here's a question, how the fuck isn't this the lead story.  I know, Roy Moore.  You can't have two major stories at the same time?

Let's assume that pretty much all the allegations are true.  Why is each being treated as a new thing? Why are they being covered the way they are? We have laws against sexual harassment and sexual but remember those three things... 

We already know money tips the scales of justice to towards those who have it.  Is this hard proof there's a class of people laws don't apply to? How the fuck are former foreign agents allowed to operate like this?  Where's the outrage?  Investigations by congress and the FBI? 

**So here's the real question, is there manipulation to bury the elements I've described?**

**Bonus question, is reddit being used?** 

There's a [thread on  r/news](https://www.reddit.com/r/news/comments/7c65uq/actor_george_takei_accused_of_sexual_assault_by/) right now with 25k upvotes regarding some allegations.  It comes down to this 36 years ago George Takei met a gay model who was 23.  A year later they met at a bar after the model had broken up with his boyfriend. They go back Takei's apartment for more drinks.  The kid, Brunton, says he passed out and came to with Takei's hands down his pants. He freaked out and left.  If everything happened exactly like that George could have been charged with sexual assault.  Two problems tho: the statute of limitations expired 26 years ago and I thought we were talking about **open, repeated, and enabled.** By the way the current count of women coming out about Weinstein alone is at around 40.
 
edit:  i coudn't get the damn formating to work right from my phione.",conspiracy,Harvey Weinstein
