,title,score,id,url,comms_num,created,body,subreddit,query
31,Seal Accuses Oprah of Knowing About Harvey Weinstein’s Sexual Misconduct,754.0,e46lwc,https://variety.com/2018/music/news/seal-accuses-oprah-knowing-about-weinstein-misconduct-1202661226/amp/?__twitter_impression=true,103.0,1575160772.0,,conspiracy,Harvey Weinstein
32,"Michelle Obama: Harvey Weinstein is a good friend, a wonderful human being",729.0,75q0iq,https://youtu.be/ahp09zPMX1w,260.0,1507737628.0,,conspiracy,Harvey Weinstein
33,Rose McGowan Turns Herself in for Arrest on Drug Charge. Meanwhile pedophile killers/rapists like John Podesta and Harvey Weinstein roam free.,719.0,7czjpg,https://www.thewrap.com/rose-mcgowan-turns-herself-in-to-be-arrested-on-drug-charge/amp/,83.0,1510699920.0,,conspiracy,Harvey Weinstein
34,"Big Surprise: Hollywood mogul Harvey Weinstein is another sexual predator, has been exploiting girls and women for 30 years.",674.0,74ncrb,https://nytimes.com/2017/10/05/us/harvey-weinstein-harassment-allegations.html?referer=https://www.reddit.com/r/The_Donald/comments/74n42n/big_surprise_liberal_lion_and_hollywood_mogul/,158.0,1507293756.0,,conspiracy,Harvey Weinstein
35,Sexual predator Harvey Weinstein undercover tapes groping and forcing woman to his room,661.0,75iz2u,https://youtu.be/oZYGn41Z_ak,342.0,1507659374.0,,conspiracy,Harvey Weinstein
36,Did Harvey Weinstein have Brittany Murphy poisoned by former Mossad agents?,627.0,7jplv3,https://www.reddit.com/r/conspiracy/comments/7jplv3/did_harvey_weinstein_have_brittany_murphy/,107.0,1513229896.0,"[Harvey Weinstein has former spies on his payroll](https://www.theguardian.com/film/2017/nov/08/ex-israeli-pm-introduced-weinstein-to-agents-who-suppressed-abuse-allegations).

Brittany Murphy was [killed under mysterious circumstances](http://www.eonline.com/ca/news/751173/e-investigates-5-reasons-brittany-murphy-s-death-is-still-a-mystery) which suggested a possible crime. Her husband Simon Monjack [died of the same mysterious cause five months later](http://www.eonline.com/ca/news/751173/e-investigates-5-reasons-brittany-murphy-s-death-is-still-a-mystery).

Brittany Murphy's father believes they were murdered. A [toxicology report found heavy metals and suggested the presence of rat poison](http://www.dailymail.co.uk/news/article-2509626/Brittany-Murphys-father-believes-husband-poisoned-death-government-spooks.html).

Salma Hayek says that Weinstein told her, [""I'll kill you. Don't think I can't""](https://www.nytimes.com/interactive/2017/12/13/opinion/contributors/salma-hayek-harvey-weinstein.html?action=click&pgtype=Homepage&clickSource=collection&module=opinion-c-col-top-region&region=opinion-c-col-top-region&WT.nav=opinion-c-col-top-region). This could be an empty threat, or he could know from experience.

[Weinstein creeped on Murphy](http://media.gettyimages.com/photos/actress-brittany-murphy-and-producer-harvey-weinstein-are-seen-inside-picture-id52952535?s=612x612). Probably, she had similar experiences of[ terrifying abuse](http://theweek.com/speedreads/743240/salma-hayek-divulges-years-terrifying-abuse-by-harvey-weinstein), like the allegations made by so many other women. Her and her husband may have been intending to do or say something about it. Or maybe one of them just pissed him off.

Did Murphy or her husband do or say anything to push Weinstein to order one of his Mossad agents to poison them? Is this why Weinstein was so confident threatening Salma Hayek by saying he could kill her?",conspiracy,Harvey Weinstein
37,Twitter suspends actress Rose McGowan’s account for calling out Ben Affleck and Harvey Weinstein on sexual assault.,610.0,75vw5l,https://www.google.com/amp/www.hollywoodreporter.com/amp/news/twitter-suspends-rose-mcgowans-account-1048018,48.0,1507800782.0,,conspiracy,Harvey Weinstein
38,Harvey Weinstein manhandling Emma Watson,605.0,75tv0z,http://i.magaimg.net/img/1l80.jpg,196.0,1507773050.0,,conspiracy,Harvey Weinstein
39,"Harvey Weinstein Indicted On More Charges, Including Predatory Sexual Assault",602.0,8vk5f3,https://www.huffingtonpost.com/entry/harvey-weinstein-indicted-on-more-charges-including-predatory-sexual-assault_us_5b3a428fe4b05127cceade61,68.0,1530550053.0,,conspiracy,Harvey Weinstein
40,"""Harvey Weinstein in critical condition""",585.0,fo8ph0,https://i.imgur.com/zKxjIlr.png,83.0,1585069626.0,,conspiracy,Harvey Weinstein
41,Sexual Predator Harvey Weinstein made 13 visits to the White House between 2010 and 2014 meeting Crooked Politicians around the time Podesta had huge influence in the White House,581.0,74u35a,https://i.imgur.com/6JbMOvO.jpg,222.0,1507371191.0,,conspiracy,Harvey Weinstein
42,Harvey Weinstein and Jennifer Lawrence praise and present Bill Clinton at GLAAD Awards. Awkward and mentions of vacations and watching movies together.,586.0,75hapk,https://youtube.com/watch?v=w_BXdFtwZsE&feature=youtu.be,198.0,1507644746.0,,conspiracy,Harvey Weinstein
43,"People on this sub championing the Oprah interview as people exposing the Royals. What kind of shit is this, shills making this a gossip column sub",554.0,m0vlr4,https://www.reddit.com/r/conspiracy/comments/m0vlr4/people_on_this_sub_championing_the_oprah/,132.0,1615253637.0,"He’s not doing anything of the sort, nothing gets done without their consent, this is all a distraction.

So the ginger cunt and his handler go to Oprah (best friends and promoter of John of god and Harvey Weinstein) to tell the truth on his family who are best friends and coverup Prince Andrew and Jimmy Saville. They are all in it together and it’s just colosseum games to keep the gullible normies distracted. If people even believe this crap then I don’t know why they are even on this sub

It’s just another bullshit distraction to promote the everyone is racist bollox narrative and everyone eating it up, clowns",conspiracy,Harvey Weinstein
44,FBI Harvey Weinstein probe ordered by Trump Justice Dept,481.0,75sryf,http://www.dailymail.co.uk/news/article-4971192/FBI-Harvey-Weinstein-probe-ordered-Trump-Justice-Dept.html?ito=social-twitter_dailymailus,115.0,1507761868.0,,conspiracy,Harvey Weinstein
45,America is run by Satan worshipping pedophiles!,475.0,sv4afv,https://www.reddit.com/r/conspiracy/comments/sv4afv/america_is_run_by_satan_worshipping_pedophiles/,87.0,1645145076.0,"Republican benefactor of conservative Christian groups, Richard A. Dasen Sr., was charged with rape for allegedly paying a 15-year old girl for sex. Dasen, 62, who is married with grown children and several grandchildren, has allegedly told police that over the past decade he paid more than $1 million to have sex with a large number of young women. 

Democratic donor and billionaire, Jeffrey Epstein, ran an underage child sex brothel and was convicted of soliciting underage girls for prostitution. 

Democratic New York Congressman, Anthony Weiner, plead guilty to transferring obscene material to a minor as part of a plea agreement for sexted and sending Twitter DMs to underage girls as young as 15. 

Democratic donor, activist, and Hollywood producer Harvey Weinstein is being criminally prosecuted and civilly sued for years of sexual abuse (that was well known “secret” in Hollywood) including underage sexual activities with aspiring female actresses. 

Democratic activist and #metoo proponent, Asia Argento, settled a lawsuit for sexual harassment stemming from sexual activities with an underage actor. 

Democratic Mayor of Racine, Wisconsin, Gary Becker, was convicted of attempted child seduction, child pornography, and other child sex crimes. 

Democratic Seattle Mayor Ed Murray resigned after multiple accusations of child sexual abuse were levied against him including by family members. 

Democratic activist and aid to NYC Mayor De Blasio, Jacob Schwartz was arrested on possession of 3,000+ child pornographic images. 

Democratic activist and actor, Russell Simmons, was sued based on an allegation of sexual assault where he coerced an underage model for sex. 

Democratic Governor of Oregon, Neil Goldschmidt, after being caught by a newspaper, publicly admitted to having a past sexual relationship with a 13-year-old girl after the statute of limitations on the rape charges had expired. 

Democratic Illinois Congressman, Mel Reynolds resigned from Congress after he was convicted of statutory rape of a 16-year-old campaign volunteer. 

Democratic New York Congressman, Fred Richmond, was arrested in Washington D.C. for soliciting sex from a 16-year-old boy. 

Democratic activist, donor, and director, Roman Polanski, fled the country after pleading guilty to statutory rape of a 13-year-old girl. 

Democrats and Hollywood actors still defend him to this day, including, Whoopi Goldberg, Martin Scorcese, Woody Allen, David Lynch, Wim Wenders, Pedro Almodovar, Tilda Swinton and Monica Bellucci. 

Democratic State Senator from Alaska, George Jacko, was found guilty of sexual harassment of an underage legislative page. 

Democratic State Representative candidate for Colorado, Andrew Myers, was convicted for possession of child pornography and enticing children. 

Democratic Illinois Congressman, Gus Savage was investigated by the Democrat-controlled House Committee on Ethics for attempting to rape an underage female Peace Corps volunteer in Zaire. The Committee concluded that while the events did occur his apology was sufficient and took no further action. 

Democratic activist, donor, and spokesperson for Subway, Jared Fogle, was convicted of distribution and receipt of child pornography and traveling to engage in illicit sexual conduct with a minor. 

Democratic State Department official, Carl Carey, under Hillary Clinton’s state department, was arrested on ten counts of child porn possession. 

Democratic Maine Assistant Attorney General, James Cameron, was sentenced to just over 15 years in federal prison for seven counts of child porn possession, receipt and transmission. 

Democratic State Department official, Daniel Rosen, under Hillary Clinton’s state department, was arrested and charged with allegedly soliciting sex from a minor over the internet. 

Democratic State Department official, James Cafferty, pleaded guilty to one count of transportation of child pornography. 

Democratic radio host, Bernie Ward, plead guilty to one count of sending child pornography over the Internet.

Democratic deputy attorney general from California, Raymond Liddy, was arrested for possession of child pornography.

Republican activist Marty Glickman (a.k.a. “Republican Marty”), was taken into custody by Florida police on four counts of unlawful sexual activity with an underage girl and one count of delivering the drug LSD. 

Republican legislative aide Howard L. Brooks was charged with molesting a 12-year old boy and possession of child pornography. 

Republican Senate candidate John Hathaway was accused of having sex with his 12-year old baby sitter and withdrew his candidacy after the allegations were reported in the media. 

Republican preacher Stephen White, who demanded a return to traditional values, was sentenced to jail after offering $20 to a 14-year-old boy for permission to perform oral sex on him. 

Republican talk show host Jon Matthews pleaded guilty to exposing his genitals to an 11 year old girl. 

Republican anti-gay activist Earl “Butch” Kimmerling was sentenced to 40 years in prison for molesting an 8-year old girl after he attempted to stop a gay couple from adopting her. 

Republican Party leader Paul Ingram pleaded guilty to six counts of raping his daughters and served 14 years in federal prison. 

Republican election board official Kevin Coan was sentenced to two years probation for soliciting sex over the internet from a 14-year old girl. 

Republican politician Andrew Buhr was charged with two counts of first degree sodomy with a 13-year old boy. 

Republican politician Keith Westmoreland was arrested on seven felony counts of lewd and lascivious exhibition to girls under the age of 16 (i.e. exposing himself to children). 

Republican anti-abortion activist John Allen Burt was charged with sexual misconduct involving a 15-year old girl. 

Republican County Councilman Keola Childs pleaded guilty to molesting a male child. Republican activist John Butler was charged with criminal sexual assault on a teenage girl.

Republican candidate Richard Gardner admitted to molesting his two daughters. 

Republican Councilman and former Marine Jack W. Gardner was convicted of molesting a 13-year old girl. 

Republican County Commissioner Merrill Robert Barter pleaded guilty to unlawful sexual contact and assault on a teenage boy. 

Republican City Councilman Fred C. Smeltzer, Jr. pleaded no contest to raping a 15 year-old girl and served 6-months in prison. 

Republican activist Parker J. Bena pleaded guilty to possession of child pornography on his home computer and was sentenced to 30 months in federal prison and fined $18,000. 

Republican parole board officer and former Colorado state representative, Larry Jack Schwarz, was fired after child pornography was found in his possession. 

Republican strategist and Citadel Military College graduate Robin Vanderwall was convicted in Virginia on five counts of soliciting sex from boys and girls over the internet. 

Republican city councilman Mark Harris, who is described as a “good military man” and “church goer,” was convicted of repeatedly having sex with an 11-year-old girl and sentenced to 12 years in prison. 

Republican businessman Jon Grunseth withdrew his candidacy for Minnesota governor after allegations surfaced that he went swimming in the nude with four underage girls, including his daughter. 

Republican director of the “Young Republican Federation” Nicholas Elizondo molested his 6-year old daughter and was sentenced to six years in prison.

Democratic California Congressman, Tony Cárdenas, is being sued in LA County for allegedly sexually abused a 16-year-old girl. 

Democratic aide to Senator Barbara Boxer, Jeff Rosato, plead guilty to charges of trading in child pornography. 

Democratic Alaskan State Representative, Dean Westlake, resigned from his seat after the media published a report alleging he fathered a child with a 16-year-old girl when he was 28. 

Democratic New Jersey State Assemblyman, Neil Cohen, was convicted of possession and distribution of child pornography. 

Republican Tim Nolan, chairman of Donald Trump’s presidential campaign in Kentucky, pled guilty to child sex trafficking and on February 11, 2018 he was sentenced to serve 20 years in prison. 

Republican state Senator Ralph Shortey was indicted on four counts of human trafficking and child pornography. 

In November 2017, he pleaded guilty to one count of child sex trafficking in exchange for the dropping of the other charges. 

Republican anti-abortion activist Howard Scott Heldreth is a convicted child rapist in Florida. 

Republican County Commissioner David Swartz pleaded guilty to molesting two girls under the age of 11 and was sentenced to 8 years in prison. 

Republican judge Mark Pazuhanich pleaded no contest to fondling a 10-year old girl and was sentenced to 10 years probation. 

Republican anti-abortion activist Nicholas Morency pleaded guilty to possessing child pornography on his computer and offering a bounty to anybody who murders an abortion doctor. 

Republican legislator Edison Misla Aldarondo was sentenced to 10 years in prison for raping his daughter between the ages of 9 and 17. 

Republican Mayor Philip Giordano is serving a 37-year sentence in federal prison for sexually abusing 8- and 10-year old girls. 

Republican campaign consultant Tom Shortridge was sentenced to three years probation for taking nude photographs of a 15-year old girl. 

Republican Senator Strom Thurmond, a notable racist, had sex with a 15-year old black girl which produced a child. 

Republican pastor Mike Hintz, whom George W. Bush commended during the 2004 presidential campaign, surrendered to police after admitting to a sexual affair with a female juvenile. 

Republican legislator Peter Dibble pleaded no contest to having an inappropriate relationship with a 13-year-old girl. 

Republican Congressman Donald “Buz” Lukens was found guilty of having sex with a female minor and sentenced to one month in jail. 

Republican fundraiser Richard A. Delgaudio was found guilty of child porn charges and paying two teenage girls to pose for sexual photos. 

Republican activist Mark A. Grethen convicted on six counts of sex crimes involving children. 

Republican activist Randal David Ankeney pleaded guilty to attempted sexual assault on a child. 

Republican Congressman Dan Crane had sex with a female minor working as a congressional page. 

Republican activist and Christian Coalition leader Beverly Russell admitted to an incestuous relationship with his step daughter. 

Republican congressman and anti-gay activist Robert Bauman was charged with having sex with a 16-year-old boy he picked up at a gay bar. 

Republican Committee Chairman Jeffrey Patti was arrested for distributing a video clip of a 5-year-old girl being raped.

Democratic Illinois State Representative, Keith Farnham, has resigned and was charged with possession of child pornography and has been accused of bragging at an online site about sexually molesting a 6-year-old girl. 

Democratic spokesperson for the Arkansas Democratic Party, Harold Moody, Jr, was charged with distribution and possession of child pornography. 

Democratic Radnor Township Board of Commissioners member, Philip Ahr, resigned from his position after being charged with possession of child pornography and abusing children between 2 and 6 years-old. 

Democratic activist and BLM organizer, Charles Wade, was arrested and charged with human trafficking and underage prostitution. 

Democratic Texas attorney and activist, Mark Benavides, was charged with having sex with a minor, inducing a child under 18 to have sex and compelling prostitution of at least nine legal clients and possession of child pornography. He was found guilty on six counts of sex trafficking. 

Democratic Virginia Delegate, Joe Morrissey, was indicted on charges connected to his relationship with a 17-year-old girl and was charged with supervisory indecent liberties with a minor, electronic solicitation of a minor, possession of child pornography and distribution of child pornography. 

Democratic Massachusetts Congressman, Gerry Studds, was censured by the House of Representatives after he admitted to an inappropriate relationship with a 17-year-old page. 

Democratic Former Mayor of Stillwater, New York, Rick Nelson was plead guilty to five counts of possession of child pornography of children less than 16 years of age. 

Democratic Former Mayor of Clayton, New York, Dale Kenyon, was indicted for sexual acts against a teenager. 

Democratic Former Mayor of Hubbard, Ohio, Richard Keenan, was given a life sentence in jail for raping a 4-year-old girl. 

Democratic Former Mayor of Winston, Oregeon, Kenneth Barrett, was arrested for setting up a meeting to have sex with a 14-year-old girl who turned out to be a police officer. 

Democratic Former Mayor of Randolph, Nebraska, Dwayne L. Schutt, was arrested and charged with four counts of felony third-degree sexual assault of a child and one count of intentional child abuse. 

Democratic Former Mayor of Dawson, Georgia, Christopher Wright, was indicted on the charges of aggravated child molestation, aggravated sodomy, rape, child molestation and statutory rape of an 11-year-old boy and a 12-year-old girl. 

Democratic Former Mayor of Stockton, California, Anthony Silva, was charged with providing alcohol to young adults during a game of strip poker that included a 16-year-old boy at a camp for underprivileged children run by the mayor. 

Democratic Former Mayor of Millbrook, New York, Donald Briggs, was arrested and charged with inappropriate sexual contact with a person younger than 17. 

Democratic party leader for Victoria County, Texas, Stephen Jabbour, plead guilty to possession and receiving over half a million child pornographic images. 

Democratic activist and fundraiser, Terrence Bean, was arrested on charges of sodomy and sex abuse in a case involving a 15-year-old boy and when the alleged victim declined to testify, and the judge dismissed the case. 

Democratic Party Chairman for Davidson County, Tennessee, Rodney Mullin, resigned amid child pornography allegations. 

Democratic activist, Andrew Douglas Reed, pleaded guilty to a multiple counts of 2nd-degree sexual exploitation of a minor for producing child pornography. 

Democratic official from Terre Haute, Indiana, David Roberts was sentenced to federal prison for producing and possessing child pornography including placing hidden cameras in the bedrooms and bathrooms at a home he shared with two minor female victims.",conspiracy,Harvey Weinstein
